chunk_id,doc_set,norma_id,norma_titulo,version_corte,idioma,seccion,subseccion,parrafo_ini,parrafo_fin,page_ini_pdf,page_fin_pdf,content_type,text,citation,source_file,metadata_json
NICSP 05-P9004,NICSP,NICSP 05,COSTOS POR PRÉSTAMOS,31-01-2025,es,Fundamentos de las conclusiones,,9004,9004,14,18,paragraph,"Estos Fundamentos de las conclusiones acompañan a la , pero no son parte de la misma.
Revisión de la  como resultado del documento del IPSASB La Aplicabilidad de las NICSP,  emitido en
abril de 2016
FC1.  El IPSASB emitió La Aplicabilidad de las NICSP  en abril de 2016. Este pronunciamiento modifica las
referencias en todas las NICSP de la forma siguiente:
(a) elimina los párrafos estándar sobre La Aplicabilidad de las NICSP  a “entidades del sector público
distintas de las EP” de la sección de alcance de cada Norma;
(b) sustituye el término “EP” por el término “entidades del sector público comercial”, cuando procede; y
(c) modifica el párrafo 10 del Prólogo a las Normas Internacionales de Contabilidad del Sector Público
proporcionando una descripción positiva de las entidades del sector público para las que se han
diseñado las NICSP.
Las razones de estos cambios se establecen en los Fundamentos de las conclusiones de la NICSP 1.
Revisión de la  como resultado del documento Mejoras a las NICSP, 2018
FC2.  El IPSASB revisó las revisiones a la NIC 33, Costos por préstamos , incluidas en Mejoras Anuales a las
Normas NIIF®, Ciclo 2015 a 2017 emitido por el IASB en diciembre de 2017, y los razonamientos del IASB
para hacer dichas modificaciones como se establecen en sus Fundamentos de las conclusiones. El IPSASB destacó que pese a las divergencias entre la  y la NIC 23, el tratamiento c ontable alternativo
permitido en la  es congruente con la contabilización en la NIC 23. El IPSASB concluyó, por  tanto,
que no había una razón específica del sector público para la no adopción de las modificaciones. El IPSASB coincidió con la opinión del IASB de que los costos de aplicar las modificaciones retroactivamente podrían
exceder los beneficios potenciales de hacerlo. En consecuencia, una entidad aplica las modificaciones solo
a los costos por préstamos incurridos a partir de la fecha en que aplica por primera vez las modificaciones.
Revisión de la  como resultado del documento Mejoras a las NICSP, 2019
FC3.  Las modificaciones al párrafo 6 actualizan las guías sobre los componentes de los costos por préstamos
que resultan de la NICSP 41 Instrumentos Financieros , que fueron omitidos inadvertidamente cuando se
emitió la NICSP 41. El IPSASB estuvo de acuerdo en incluir estas modificaciones menores en Mejoras a las
NICSP, 2019 .
Revisión de la  como resultado de COVID -19: Diferimiento de las Fechas de Vigencia
FC4.  El IPSASB publicó Mejoras a las NICSP 2019 en enero de 2020. Dicho documento incluía modificaciones a
la  Costos por Préstamos.  En el momento en que se finalizaron estas modificaciones, el Consejo
decidió que una entidad las aplicar a para los estados financieros anuales que cubran periodos que
comiencen a partir del 1 de enero de 2022.
FC5.  En junio de 2020, el IPSASB analizó el efecto de la pandemia COVID -19 en la información financiera. El
Consejo destacó que la pandemia ha creado presiones significativas en los recursos del sector público que
las entidades podrían asignar, en otro caso, a la implementación de estas modificaciones.
FC6.  El Consejo concluyó que el diferimiento durante un periodo de perturbaciones importantes proporcionaría
un alivio operativo muy necesario a las entidades del sector público. Por ello, el Consejo decidió proponer
un año de diferimiento de la fecha de vigen cia de estas modificaciones.
FUNDAMENTOS DE LAS CONCLUSIONES  FC7.  El Consejo no propuso otros cambios en estas modificaciones distintos del diferimiento de la fecha de
vigencia. Se continúa permitiendo la aplicación anticipada de las modificaciones.
Revisión de la  como resultado del Documento de Consulta del IPSASB Medición,  emitido en abril de
2019
FC8.  En abril de 2019, el IPSASB publicó el Documento de Consulta Medición. El Documento de Consulta
proponía un marco integral que destacaba cómo deben determinarse las bases de medición cuando se
aplican en el contexto de las NICSP. Uno de los objetivos del Documento de Consulta era reunir opiniones sobre la conveniencia de suprimir una de las opciones de política contable de la , Costos por
Préstamos .
FC9.  La  permite dos opciones de política contable para los costos por préstamos directamente atribuibles a la adquisición, construcción o producción de un activo apto: capitalización o reconocimiento como gasto.
FC10.  El IPSASB propuso eliminar la opción de capitalizar los costos por préstamos con el fin de:
(a) Abordar un problema del sector público cuando el endeudamiento está centralizado y se determina
para la entidad económica en su conjunto. La contabilización como gasto de los costos por
préstamos reduce la carga de atribuir los costos por préstamos central izados a proyectos
específicos dentro del sector público;
(b) Mejorar la comparabilidad entre el costo de adquisición, construcción o producción de un activo apto
entre entidades del sector público; y
(c) Alinearse más estrechamente con los requerimientos del Manual de Estadísticas Financieras
Públicas (MEFP) de 2014.
FC11.  Al desarrollar su opinión preliminar, el IPSASB reconoció la complejidad de la cuestión. Esta complejidad, y las opiniones opuestas sobre lo que debería incluirse en el costo, dieron lugar a que las respuestas a la
opinión preliminar estuvieran divididas,  con muchos de quienes respondieron apoyando la propuesta del
Consejo y, del mismo modo, muchos otros en desacuerdo. Los que se mostraron en desacuerdo con la
propuesta de eliminar la opción de política contable existente consideraron que las razones aducidas para
hacerlo eran insuficientes. Ellos argumentaron que:
(a) las dificultades para atribuir costos por préstamos a proyectos específicos en el sector público eran
exageradas y constituían una razón insuficiente para apartarse del tratamiento contable del sector
privado. Los grandes conglomerados del sector privado s e enfrentan a dificultades similares y son
capaces de capitalizar los costos por préstamos;
(b) los costos por préstamos que son directamente atribuibles a la adquisición, construcción o producción
de un activo apto forman parte del costo de dicho activo. Durante el periodo en el que un activo está en proceso de desarrollo, los desembolsos por los recursos utilizados deben ser financiados. La
financiación tiene un costo. El costo del activo debe incluir todos los costos en que sea necesario incurrir para preparar el activo para su uso previsto o venta, incluyendo los costos incurridos por la
financiac ión de desembolsos como parte del costo de adquisición, construcción o producción del
activo;
(c) la capitalización de los costos por préstamos directamente atribuibles mejora la rendición de cuentas
y la toma de decisiones; y
(d) la contabilización inmediata como gasto de los costos por préstamos sería incongruente con los
requerimientos establecidos en otras normas para capitalizar los costos de transacción directamente
atribuibles a la adquisición, construcción o producción de un activo apto.
FUNDAMENTOS DE LAS CONCLUSIONES  286 FC12.  Tras revisar las respuestas, el IPSASB decidió mantener la opción de política contable existente. Este
enfoque permite a los preparadores seleccionar la política que mejor alcance el objetivo de medición del activo apto.
FC13.  El IPSASB observó que la opción de política contable existente es congruente con los principios de medición del Marco Conceptual y permite a los preparadores de estados financieros del sector público considerar las características cualitativas de la infor mación útil al seleccionar un enfoque que represente más fielmente el
costo del activo.
FC14.  En apoyo de su decisión de mantener la opción de política contable, el IPSASB señaló lo siguiente:
(a) Tanto la capitalización como la contabilización como gasto de los costos por préstamos tienen ventajas
técnicas. En algunos casos, quienes respondieron adoptaron puntos de vista opuestos: por ejemplo,
sobre si los costos por préstamos son un atributo del c osto de un activo;
(b) el objetivo del enfoque al contabilizar los costos por préstamos es ayudar a los usuarios de los estados
financieros a obtener el reflejo más adecuado de los costos de adquisición, construcción o producción
de un activo apto, que en algunos casos pueden in cluir los costos por préstamos;
(c) aunque en determinados niveles de gobierno la imputación de los costos por préstamos constituye un
reto, en otros niveles, como el de los gobiernos locales, puede resultar relativamente sencilla;
(d) la capitalización de los costos por préstamos se ajustaría a las NIIF si este fuera el enfoque preferido
de una entidad económica, mientras que la contabilización de los costos por préstamos se ajustaría a
las EFP si este fuera el enfoque preferido por una entidad económica; y
(e) tendría que haber un beneficio claro de contabilizar como gasto todos los costos por préstamos antes
de que el IPSASB eliminara la opción de política contable existente de capitalizar los costos por
préstamos. Dado que existen costos inevitables al eliminar una opción de política contable, el IPSASB consideró cuidadosamente los costos y beneficios de cualquier nuevo pronunciamiento. En este caso,
al Consejo no se le había informado de que los preparadores que eligieron capitalizar los costos por
préstamos s egún la  hayan encontrado dicha capitalización innecesariamente gravosa.
FC15.  Algunos de quienes respondieron al Documento de Consulta identificaron problemas prácticos en el sector
público al capitalizar los costos por préstamos. Por ello, el IPSASB elaboró una Guía de implementación y
Ejemplos ilustrativos para ayudar a las entidades a determinar en qué medida pueden capitalizarse los costos por préstamos.
Distinción entre costos por intereses y costos de transacción
FC16.  Al llegar a la conclusión de mantener la opción de política contable, el IPSASB destacó que la contabilización
de los costos por préstamos puede no ser congruente con la contabilización de los costos de transacción. Algunos de quienes respondieron propusi eron que el tratamiento contable de los costos por préstamos y de
los costos de transacción debería ser congruente porque consideraban que:
(a) Los costos por préstamos son un tipo de costos de transacción. Los costos por préstamos son
directamente atribuibles a la financiación (por ejemplo, la emisión de un instrumento financiero del
gobierno). Por lo tanto, cumplen los criterios de un costo de t ransacción; o
(b) Los costos de transacción son un tipo de costos por préstamos. Algunos de quienes respondieron
propusieron esta opinión basándose en la metodología aplicada para calcular la tasa de interés
efectiva de un instrumento financiero. Esto se debe a que algunos costos de transacción se suman o
restan del importe del principal de un instrumento financiero al determinar los recursos brutos de un
préstamo con el fin de determinar la tasa de interés efectiva.
FUNDAMENTOS DE LAS CONCLUSIONES  FC17.  El IPSASB consideró estos puntos de vista, pero decidió que los costos por préstamos y los costos de
transacción son fenómenos económicos diferentes. El IPSASB concluyó que es apropiado que los principios contables difieran para cada tipo de “costo” depen diendo de los hechos y circunstancias.
FC18.  Al alcanzar esta opinión, el IPSASB destacó que los costos por préstamos comprenden los intereses y otros gastos incurridos por una entidad en relación con el préstamo de fondos. Los costos por préstamos suelen estar vinculados contractualmente al préstam o subyacente. Si se transfiriera el préstamo, los costos por
préstamos se transferirían a la nueva contraparte o se separarían contractualmente.
FC19.  Los costos de transacción son costos incrementales directamente atribuibles a la transacción. Sin embargo,
los costos de transacción son independientes de las condiciones contractuales del instrumento de deuda. Si
se transfiriera el instrumento de deuda, l a entidad que transfiere el instrumento no suele ser compensada
por los costos de transacción, ya que no se transfieren a la contraparte que asume el instrumento.
FUNDAMENTOS DE LAS CONCLUSIONES  288",NICSP 05 — COSTOS POR PRÉSTAMOS — Fundamentos de las conclusiones — párr. Fundamentos de las conclusiones — p. 14-18,NICSP 05.pdf,"{""chunk_id"": ""NICSP 05-P9004"", ""doc_set"": ""NICSP"", ""norma_id"": ""NICSP 05"", ""norma_titulo"": ""COSTOS POR PRÉSTAMOS"", ""version_corte"": ""31-01-2025"", ""idioma"": ""es"", ""seccion"": ""Fundamentos de las conclusiones"", ""subseccion"": null, ""parrafo_ini"": 9004, ""parrafo_fin"": 9004, ""page_ini_pdf"": 14, ""page_fin_pdf"": 18, ""content_type"": ""paragraph"", ""qa_scope"": ""normativo"", ""source_file"": ""NICSP 05.pdf""}"
NICSP 05-P9005,NICSP,NICSP 05,COSTOS POR PRÉSTAMOS,31-01-2025,es,Guía de implementación,,9005,9005,19,20,paragraph,"Esta guía acompaña a la , pero no es parte de la misma.
A.1 Periodo de capitalización de los costos por préstamos
Al aplicar el tratamiento alternativo permitido, tal como se describe en los párrafos 17 a 18, ¿cuándo puede
una entidad empezar a incluir los costos por préstamos en el costo del activo apto?
Cuando se haya incurrido en desembolsos y préstamos específicamente para financiar la adquisición, construcción o
producción de un activo apto, los costos de dichos préstamos deben capitalizarse cuando comiencen las actividades
necesarias para preparar el activo para su uso previsto o venta. Las actividades necesarias para que el activo esté
listo para su uso abarcan más que la adquisición física, construcción o producción del activo. Las actividades incluyen
el trabajo técnico y administrativo previo al inicio de la adquisición física, construcción o producción, pero excluyen la
tenencia del activo cuando no se está llevando a cabo ningún desarrollo que cambie el estado del activo.
Las actividades (es decir, el trabajo técnico y administrativo) realizadas antes del inicio de la adquisición física,
construcción o producción de un activo apto deben contribuir al desarrollo o construcción real de dicho activo.
A.2 Límite de capitalización
Cuando se aplica el tratamiento alternativo permitido, tal como se describe en los párrafos 17 y 18, a préstamos
específicos, ¿se limitan los costos por préstamos incluidos en el costo del activo apto en ese periodo a los
costos por préstamos incurridos en ese periodo?
Sí. Si un préstamo puede asociarse específicamente con desembolsos para la adquisición, construcción o producción
de un activo apto, el importe de los costos por préstamos capitalizados durante ese periodo se limita a los costos por
préstamos en que se hay a incurrido por ese préstamo durante el periodo, menos los rendimientos conseguidos por la
colocación de tales fondos en inversiones temporales.
A.3 Activo financiado mediante transferencias
En muchas jurisdicciones, la adquisición, construcción o producción de un activo apto se financia mediante
una transferencia de otra entidad del sector público. ¿Tiene en cuenta la entidad que adquiere, construye o
produce el activo apto la fuente subyacen te de los fondos del transferidor, es decir, si los fondos proceden de
ingresos fiscales, de tenencias generales de efectivo o de préstamos, cuando determina el importe que puede
incluirse en el costo del activo apto al aplicar el tratamiento alternativo p ermitido, tal como se describe en los
párrafos 17 y 18?
No. Cuando la adquisición, construcción o producción de un activo apto se financie en su totalidad mediante una
transferencia, no habrá costos por préstamos directamente atribuibles que capitalizar. La entidad puede incluir en el
costo del activo apto únic amente aquellos costos por préstamos en los que haya incurrido.
A.4 Activos financiados a través de un programa centralizado de préstamos – Tasas de interés
Una agencia de préstamos centralizada puede financiar sus actividades mediante préstamos tomados a través
de varios instrumentos de préstamo separados. Cada instrumento puede tener una tasa de interés diferente.
Una entidad puede tomar fondos prestados de la agencia de préstamos centralizada y utilizarlos para la
adquisición, construcción o producción de un activo apto. Si la entidad está utilizando el tratamiento
alternativo permitido, tal como se describe en los párrafos 17 y 18, ¿aplica la entidad la tasa de interés promedio ponderada incurrida por la agencia de préstamos centralizada al incluir los costos por préstamos en
el costo del activo apto?
No. La tasa de interés promedio ponderada incurrida por la agencia de préstamos centralizada no es relevante en la
preparación de los estados financieros de la entidad que adquiere, construye o produce el activo apto. La entidad
GUÍA DE IMPLEMENTACIÓN  290 puede incluir en el costo del activo apto únicamente aquellos costos por préstamos en los que ella misma haya
incurrido.
La entidad debe considerar todos los hechos y circunstancias al determinar los costos por préstamos incurridos en su
acuerdo con la agencia de préstamos centralizada. En algunos casos, la tasa de interés establecida en las condiciones
del acuerdo puede no reflejar los verdaderos costos por intereses asociados con los fondos recibidos. Cuando la
entidad identifique condiciones favorables, la entidad debe aplicar los requerimientos de la NICSP 41, Instrumentos
Financieros , párrafos GA118 a GA1272 y capitalizar los costos por préstamos basados en una tasa de interés
relacionada de mercado en la que la entidad habría incurrido en un préstamo similar (véase la NICSP 41, EI153 a
EI172 para ejemplos que ilustran cómo determinar la tasa de interés en un préstamo en condiciones favorables). Los
gastos por intereses calculados utilizando el método de la tasa de interés efectiva son susceptibles de inclusión en el
costo del activo apto de acuerdo con esta Norma.
Si agencia de préstamos centralizada y la entidad a la que presta fondos forman parte de la misma entidad económica,
en los estados financieros de la entidad consolidada, los costos por préstamos en los que haya incurrido la agencia de
préstamos centralizada pueden capitalizarse como parte del activo apto, siempre que se hayan realizado los ajustes
de consolidación adecuados para eliminar los costos capitalizados por la entidad controlada.
A.5 Activo financiado mediante préstamos genéricos propios de una entidad - Préstamos que no son específicos del
activo apto
Cuando una entidad que adquiere, construye o produce un activo apto gestiona su propio programa de préstamos, pero los préstamos no son específicos del activo apto, ¿cómo determina la entidad los costos por
préstamos directamente atribuibles al activo apto ? Esto puede ocurrir cuando una entidad utiliza el efectivo
disponible en caja para financiar el costo de un activo apto. Este efectivo disponible en caja se financia con préstamos genéricos, ingresos fiscales y otras tasas y transferencias.
El importe de los costos por préstamos susceptible de inclusión en el costo del activo apto se determina utilizando la
media ponderada de los costos por préstamos aplicables a todos los préstamos de la entidad vigentes durante el
periodo. A continuación, el promedio ponderado de los costos por préstamos se aplicará a los desembolsos en el activo
apto incurridos durante el periodo para determinar el importe susceptible de capitalización.
La entidad excluirá del cálculo del promedio ponderado aquellos préstamos efectuados específicamente con el
propósito de obtener otro activo apto hasta que se hayan completado sustancialmente todas las actividades necesarias
para preparar ese activo para s u uso previsto. El importe de los costos por préstamos capitalizados durante un periodo
no debe exceder del importe de los costos por préstamos incurridos durante ese periodo.
A.6 Activo financiado mediante préstamos genéricos - Variedad de instrumentos de deuda
¿Aplica una entidad un promedio ponderado de costos por préstamos cuando se utilizan varios instrumentos
de deuda para financiar el costo de un activo apto?
Sí. Es posible que una entidad no pueda financiar el costo de un activo apto con un único instrumento de deuda.
Cuando se utilizan múltiples instrumentos de deuda, el costo de los préstamos se determina calculando el promedio
ponderado de los costos por pr éstamos aplicables a todos los instrumentos de deuda vigentes durante el periodo,
excluyendo los préstamos efectuados específicamente con el propósito de obtener otro activo apto (hasta que se hayan
completado sustancialmente todas las actividades necesari as para preparar ese activo para el uso previsto).
Cuando una entidad no haya adoptado todavía la NICSP 41, se aplicarán los requerimientos de la NICSP 29, Instrumentos financieros:
Reconocimiento y Medición, párrafos GA84 a GA90. De forma similar a los requerimientos de la NICSP 41, una entidad debe capitalizar los
costos por préstamos basándose en una tasa de interés relacionada de mercado en el que la entidad constructora habría incurri do en un
préstamo si milar.",NICSP 05 — COSTOS POR PRÉSTAMOS — Guía de implementación — párr. Guía de implementación — p. 19-20,NICSP 05.pdf,"{""chunk_id"": ""NICSP 05-P9005"", ""doc_set"": ""NICSP"", ""norma_id"": ""NICSP 05"", ""norma_titulo"": ""COSTOS POR PRÉSTAMOS"", ""version_corte"": ""31-01-2025"", ""idioma"": ""es"", ""seccion"": ""Guía de implementación"", ""subseccion"": null, ""parrafo_ini"": 9005, ""parrafo_fin"": 9005, ""page_ini_pdf"": 19, ""page_fin_pdf"": 20, ""content_type"": ""paragraph"", ""qa_scope"": ""normativo"", ""source_file"": ""NICSP 05.pdf""}"
