chunk_id,doc_set,norma_id,norma_titulo,version_corte,idioma,seccion,subseccion,parrafo_ini,parrafo_fin,page_ini_pdf,page_fin_pdf,content_type,text,citation,source_file,metadata_json
NICSP-10-P0020,NICSP,NICSP-10,INFORMACIÓN FINANCIERA EN ECONOMÍAS HIPERINFLACIONARIAS,2025-01-31,es,La reexpresión de los estados financieros,Estado de Situación Financiera,20,20,8,8,paragraph,"Puede no estar disponible un índice general de precios referido a los periodos para los que, según esta
Norma, se requiere la reexpresión de las propiedades, planta y equipo. En tales circunstancias especiales,
puede ser necesario utilizar una estimación basada, por ejemplo, en los movimientos de la tasa de cambio
entre la moneda funcional y una moneda extranjera relativamente estable.",NICSP-10 — INFORMACIÓN FINANCIERA EN ECONOMÍAS HIPERINFLACIONARIAS — La reexpresión de los estados financieros / Estado de Situación Financiera — párr. 20 — p. 8,NICSP 10.pdf,"{""chunk_id"": ""NICSP-10-P0020"", ""doc_set"": ""NICSP"", ""norma_id"": ""NICSP-10"", ""norma_titulo"": ""INFORMACIÓN FINANCIERA EN ECONOMÍAS HIPERINFLACIONARIAS"", ""version_corte"": ""2025-01-31"", ""idioma"": ""es"", ""seccion"": ""La reexpresión de los estados financieros"", ""subseccion"": ""Estado de Situación Financiera"", ""parrafo_ini"": 20, ""parrafo_fin"": 20, ""page_ini_pdf"": 8, ""page_fin_pdf"": 8, ""content_type"": ""paragraph"", ""qa_scope"": ""normativo"", ""source_file"": ""NICSP 10.pdf""}"
NICSP-10-P0021,NICSP,NICSP-10,INFORMACIÓN FINANCIERA EN ECONOMÍAS HIPERINFLACIONARIAS,2025-01-31,es,La reexpresión de los estados financieros,Estado de Situación Financiera,21,21,8,8,paragraph,"Algunas partidas no monetarias se llevan a importes corrientes en fechas distintas a la de presentación de
los estados financieros o la de adquisición; por ejemplo, propiedades, planta y equipo que han sido
revaluados en una fecha previa. En tales casos, los importes en libros se reexpresarán desde la fecha de la
revaluación.",NICSP-10 — INFORMACIÓN FINANCIERA EN ECONOMÍAS HIPERINFLACIONARIAS — La reexpresión de los estados financieros / Estado de Situación Financiera — párr. 21 — p. 8,NICSP 10.pdf,"{""chunk_id"": ""NICSP-10-P0021"", ""doc_set"": ""NICSP"", ""norma_id"": ""NICSP-10"", ""norma_titulo"": ""INFORMACIÓN FINANCIERA EN ECONOMÍAS HIPERINFLACIONARIAS"", ""version_corte"": ""2025-01-31"", ""idioma"": ""es"", ""seccion"": ""La reexpresión de los estados financieros"", ""subseccion"": ""Estado de Situación Financiera"", ""parrafo_ini"": 21, ""parrafo_fin"": 21, ""page_ini_pdf"": 8, ""page_fin_pdf"": 8, ""content_type"": ""paragraph"", ""qa_scope"": ""normativo"", ""source_file"": ""NICSP 10.pdf""}"
NICSP-10-P0022,NICSP,NICSP-10,INFORMACIÓN FINANCIERA EN ECONOMÍAS HIPERINFLACIONARIAS,2025-01-31,es,La reexpresión de los estados financieros,Estado de Situación Financiera,22,22,8,8,paragraph,"Para determinar si el importe reexpresado de una partida no monetaria ha sufrido un deterioro de su valor y
debe ser reducido, la entidad aplicará las pertinentes pruebas de deterioro de valor de los activos
establecidas en la NICSP 21, Deterioro del Valor de Activos no Generadores de Efectivo o la NICSP 26,
Deterioro del Valor de Activos Generadores de Efectivo. Por ejemplo, los importes reexpresados de las
propiedades, planta y equipo, plusvalía, patentes y marcas se reducirán a su importe recuperable o cantidad
de servicio recuperable, cuando sea apropiado, y los importes reexpresados de los inventarios se reducirán
a su valor realizable neto o costo corriente de reposición. Una entidad participada que se contabilice según
el método de la participación, puede informar en la moneda de una economía hiperinflacionaria. A fin de
calcular la participación del inversionista en los activos netos/patrimonio y en el resultado (ahorro o
desahorro) de la entidad participada, el estado de situación financiera y el estado de rendimiento financiero
de la misma serán objeto de reexpresión, de acuerdo con lo establecido en esta Norma. Cuando los estados
financieros reexpresados de la entidad participada estén expresados en una moneda extranjera, se
procederá a su conversión a las tasas de cambio de la fecha de cierre del estado de situación financiera.",NICSP-10 — INFORMACIÓN FINANCIERA EN ECONOMÍAS HIPERINFLACIONARIAS — La reexpresión de los estados financieros / Estado de Situación Financiera — párr. 22 — p. 8,NICSP 10.pdf,"{""chunk_id"": ""NICSP-10-P0022"", ""doc_set"": ""NICSP"", ""norma_id"": ""NICSP-10"", ""norma_titulo"": ""INFORMACIÓN FINANCIERA EN ECONOMÍAS HIPERINFLACIONARIAS"", ""version_corte"": ""2025-01-31"", ""idioma"": ""es"", ""seccion"": ""La reexpresión de los estados financieros"", ""subseccion"": ""Estado de Situación Financiera"", ""parrafo_ini"": 22, ""parrafo_fin"": 22, ""page_ini_pdf"": 8, ""page_fin_pdf"": 8, ""content_type"": ""paragraph"", ""qa_scope"": ""normativo"", ""source_file"": ""NICSP 10.pdf""}"
NICSP-10-P0023,NICSP,NICSP-10,INFORMACIÓN FINANCIERA EN ECONOMÍAS HIPERINFLACIONARIAS,2025-01-31,es,La reexpresión de los estados financieros,Estado de Situación Financiera,23,23,8,9,paragraph,"Usualmente, el impacto de la inflación queda reconocido en los costos por préstamos. No es apropiado
proceder a reexpresar los desembolsos efectuados en las inversiones financiadas con préstamos y, de forma
simultánea, capitalizar la parte de los costos por préstamos que compensan al prestamista por la inflación
en el mismo periodo. Esta parte de los costos por préstamos se reconoce como un gasto en el mismo periodo
en que se incurren los mencionados costos.",NICSP-10 — INFORMACIÓN FINANCIERA EN ECONOMÍAS HIPERINFLACIONARIAS — La reexpresión de los estados financieros / Estado de Situación Financiera — párr. 23 — p. 8-9,NICSP 10.pdf,"{""chunk_id"": ""NICSP-10-P0023"", ""doc_set"": ""NICSP"", ""norma_id"": ""NICSP-10"", ""norma_titulo"": ""INFORMACIÓN FINANCIERA EN ECONOMÍAS HIPERINFLACIONARIAS"", ""version_corte"": ""2025-01-31"", ""idioma"": ""es"", ""seccion"": ""La reexpresión de los estados financieros"", ""subseccion"": ""Estado de Situación Financiera"", ""parrafo_ini"": 23, ""parrafo_fin"": 23, ""page_ini_pdf"": 8, ""page_fin_pdf"": 9, ""content_type"": ""paragraph"", ""qa_scope"": ""normativo"", ""source_file"": ""NICSP 10.pdf""}"
NICSP-10-P0024,NICSP,NICSP-10,INFORMACIÓN FINANCIERA EN ECONOMÍAS HIPERINFLACIONARIAS,2025-01-31,es,La reexpresión de los estados financieros,Estado de Situación Financiera,24,24,9,9,paragraph,"Una entidad puede adquirir activos mediante un acuerdo que le permita diferir el pago, sin incurrir
explícitamente en ningún cargo por intereses. Cuando no se pueda determinar el importe de los intereses,
tales activos se reexpresarán utilizando la fecha de pago y no la de adquisición.",NICSP-10 — INFORMACIÓN FINANCIERA EN ECONOMÍAS HIPERINFLACIONARIAS — La reexpresión de los estados financieros / Estado de Situación Financiera — párr. 24 — p. 9,NICSP 10.pdf,"{""chunk_id"": ""NICSP-10-P0024"", ""doc_set"": ""NICSP"", ""norma_id"": ""NICSP-10"", ""norma_titulo"": ""INFORMACIÓN FINANCIERA EN ECONOMÍAS HIPERINFLACIONARIAS"", ""version_corte"": ""2025-01-31"", ""idioma"": ""es"", ""seccion"": ""La reexpresión de los estados financieros"", ""subseccion"": ""Estado de Situación Financiera"", ""parrafo_ini"": 24, ""parrafo_fin"": 24, ""page_ini_pdf"": 9, ""page_fin_pdf"": 9, ""content_type"": ""paragraph"", ""qa_scope"": ""normativo"", ""source_file"": ""NICSP 10.pdf""}"
NICSP-10-P0025,NICSP,NICSP-10,INFORMACIÓN FINANCIERA EN ECONOMÍAS HIPERINFLACIONARIAS,2025-01-31,es,La reexpresión de los estados financieros,Estado de Situación Financiera,25,25,9,9,paragraph,"Al comienzo del primer periodo de aplicación de esta Norma, los componentes de los activos
netos/patrimonio, excepto los resultados (ahorro o desahorro) acumulados y las reservas de revaluación de
activos, se reexpresarán aplicando un índice general de precios a las diferentes partidas, desde las fechas
en que fueron aportadas, o desde el momento en que surgieron por cualquier otra vía. Por su parte, cualquier
reserva de revaluación surgida con anterioridad se eliminará. Los resultados (ahorro o desahorro)
acumulados reexpresados se determinarán tomando como base el resto de las partidas, ya reexpresadas,
en el estado de situación financiera.",NICSP-10 — INFORMACIÓN FINANCIERA EN ECONOMÍAS HIPERINFLACIONARIAS — La reexpresión de los estados financieros / Estado de Situación Financiera — párr. 25 — p. 9,NICSP 10.pdf,"{""chunk_id"": ""NICSP-10-P0025"", ""doc_set"": ""NICSP"", ""norma_id"": ""NICSP-10"", ""norma_titulo"": ""INFORMACIÓN FINANCIERA EN ECONOMÍAS HIPERINFLACIONARIAS"", ""version_corte"": ""2025-01-31"", ""idioma"": ""es"", ""seccion"": ""La reexpresión de los estados financieros"", ""subseccion"": ""Estado de Situación Financiera"", ""parrafo_ini"": 25, ""parrafo_fin"": 25, ""page_ini_pdf"": 9, ""page_fin_pdf"": 9, ""content_type"": ""paragraph"", ""qa_scope"": ""normativo"", ""source_file"": ""NICSP 10.pdf""}"
NICSP-10-P0026,NICSP,NICSP-10,INFORMACIÓN FINANCIERA EN ECONOMÍAS HIPERINFLACIONARIAS,2025-01-31,es,La reexpresión de los estados financieros,Estado de Situación Financiera,26,26,9,9,paragraph,"Al final del primer periodo de aplicación, así como en los periodos posteriores, se reexpresarán todos los
componentes de los activos netos/patrimonio aplicando un índice general de precios a las partidas desde el
principio del periodo, o desde la fecha de aportación si es posterior. Los movimientos producidos durante el
periodo en los activos netos/patrimonio se presentan de acuerdo con la NICSP 1.",NICSP-10 — INFORMACIÓN FINANCIERA EN ECONOMÍAS HIPERINFLACIONARIAS — La reexpresión de los estados financieros / Estado de Situación Financiera — párr. 26 — p. 9,NICSP 10.pdf,"{""chunk_id"": ""NICSP-10-P0026"", ""doc_set"": ""NICSP"", ""norma_id"": ""NICSP-10"", ""norma_titulo"": ""INFORMACIÓN FINANCIERA EN ECONOMÍAS HIPERINFLACIONARIAS"", ""version_corte"": ""2025-01-31"", ""idioma"": ""es"", ""seccion"": ""La reexpresión de los estados financieros"", ""subseccion"": ""Estado de Situación Financiera"", ""parrafo_ini"": 26, ""parrafo_fin"": 26, ""page_ini_pdf"": 9, ""page_fin_pdf"": 9, ""content_type"": ""paragraph"", ""qa_scope"": ""normativo"", ""source_file"": ""NICSP 10.pdf""}"
NICSP-10-P0027,NICSP,NICSP-10,INFORMACIÓN FINANCIERA EN ECONOMÍAS HIPERINFLACIONARIAS,2025-01-31,es,La reexpresión de los estados financieros,Estado de Rendimiento Financiero,27,27,9,9,paragraph,"La presente Norma exige que todas las partidas del estado de rendimiento financiero vengan expresadas
en la unidad monetaria corriente en la fecha de presentación de los estados financieros. Para ello, todos los
importes necesitan ser reexpresados mediante la utilización de la variación experimentada por el índice
general de precios, desde la fecha en que los gastos e ingresos fueron recogidos en la contabilidad.",NICSP-10 — INFORMACIÓN FINANCIERA EN ECONOMÍAS HIPERINFLACIONARIAS — La reexpresión de los estados financieros / Estado de Rendimiento Financiero — párr. 27 — p. 9,NICSP 10.pdf,"{""chunk_id"": ""NICSP-10-P0027"", ""doc_set"": ""NICSP"", ""norma_id"": ""NICSP-10"", ""norma_titulo"": ""INFORMACIÓN FINANCIERA EN ECONOMÍAS HIPERINFLACIONARIAS"", ""version_corte"": ""2025-01-31"", ""idioma"": ""es"", ""seccion"": ""La reexpresión de los estados financieros"", ""subseccion"": ""Estado de Rendimiento Financiero"", ""parrafo_ini"": 27, ""parrafo_fin"": 27, ""page_ini_pdf"": 9, ""page_fin_pdf"": 9, ""content_type"": ""paragraph"", ""qa_scope"": ""normativo"", ""source_file"": ""NICSP 10.pdf""}"
NICSP-10-P0028,NICSP,NICSP-10,INFORMACIÓN FINANCIERA EN ECONOMÍAS HIPERINFLACIONARIAS,2025-01-31,es,La reexpresión de los estados financieros,Ganancia o pérdida en la posición monetaria neta,28,28,9,9,paragraph,"En un periodo de inflación, toda entidad que mantenga un exceso de activos monetarios sobre pasivos
monetarios, perderá poder adquisitivo, y toda entidad que mantenga un exceso de pasivos monetarios sobre
activos monetarios, ganará poder adquisitivo, siempre que tales partidas no estén vinculadas a un índice de
precios. Esta ganancia o pérdida en la posición monetaria neta, puede ser determinada como la diferencia
resultante de la reexpresión de las partidas correspondientes a los activos no monetarios, ganancias o
pérdidas acumuladas y partidas del estado de rendimiento financiero y las correcciones de los activos y
pasivos indexados. Esta ganancia o pérdida puede estimarse también aplicando el cambio en el índice
general de precios a la media ponderada, para el periodo, de la diferencia entre activos y pasivos monetarios.",NICSP-10 — INFORMACIÓN FINANCIERA EN ECONOMÍAS HIPERINFLACIONARIAS — La reexpresión de los estados financieros / Ganancia o pérdida en la posición monetaria neta — párr. 28 — p. 9,NICSP 10.pdf,"{""chunk_id"": ""NICSP-10-P0028"", ""doc_set"": ""NICSP"", ""norma_id"": ""NICSP-10"", ""norma_titulo"": ""INFORMACIÓN FINANCIERA EN ECONOMÍAS HIPERINFLACIONARIAS"", ""version_corte"": ""2025-01-31"", ""idioma"": ""es"", ""seccion"": ""La reexpresión de los estados financieros"", ""subseccion"": ""Ganancia o pérdida en la posición monetaria neta"", ""parrafo_ini"": 28, ""parrafo_fin"": 28, ""page_ini_pdf"": 9, ""page_fin_pdf"": 9, ""content_type"": ""paragraph"", ""qa_scope"": ""normativo"", ""source_file"": ""NICSP 10.pdf""}"
NICSP-10-P0029,NICSP,NICSP-10,INFORMACIÓN FINANCIERA EN ECONOMÍAS HIPERINFLACIONARIAS,2025-01-31,es,La reexpresión de los estados financieros,Ganancia o pérdida en la posición monetaria neta,29,29,9,9,paragraph,"La ganancia o pérdida en la posición monetaria neta se incluye en el estado de rendimiento financiero. El
ajuste efectuado en los activos y pasivos indexados por cambios en precios, hecho de acuerdo con el párrafo
16, se compensará con la pérdida o ganancia derivada de la posición monetaria neta. Otras partidas del
estado de rendimiento financiero, tales como los ingresos y gastos por intereses, así como las diferencias
de cambio en moneda extranjera, relacionadas con los fondos prestados o tomados en préstamo, estarán
también asociadas con la posición monetaria neta. Aunque estas partidas se revelarán por separado, puede
ser útil presentarlas de forma agrupada con la ganancia o pérdida procedente de la posición monetaria neta
en el estado de rendimiento financiero.",NICSP-10 — INFORMACIÓN FINANCIERA EN ECONOMÍAS HIPERINFLACIONARIAS — La reexpresión de los estados financieros / Ganancia o pérdida en la posición monetaria neta — párr. 29 — p. 9,NICSP 10.pdf,"{""chunk_id"": ""NICSP-10-P0029"", ""doc_set"": ""NICSP"", ""norma_id"": ""NICSP-10"", ""norma_titulo"": ""INFORMACIÓN FINANCIERA EN ECONOMÍAS HIPERINFLACIONARIAS"", ""version_corte"": ""2025-01-31"", ""idioma"": ""es"", ""seccion"": ""La reexpresión de los estados financieros"", ""subseccion"": ""Ganancia o pérdida en la posición monetaria neta"", ""parrafo_ini"": 29, ""parrafo_fin"": 29, ""page_ini_pdf"": 9, ""page_fin_pdf"": 9, ""content_type"": ""paragraph"", ""qa_scope"": ""normativo"", ""source_file"": ""NICSP 10.pdf""}"
NICSP-10-P0030,NICSP,NICSP-10,INFORMACIÓN FINANCIERA EN ECONOMÍAS HIPERINFLACIONARIAS,2025-01-31,es,La reexpresión de los estados financieros,Estado de flujos de efectivo,30,30,9,9,paragraph,"Esta Norma exige que todas las partidas del estado de flujos de efectivo se reexpresen en términos de la
unidad de medida corriente en la fecha presentación de los estados financieros.",NICSP-10 — INFORMACIÓN FINANCIERA EN ECONOMÍAS HIPERINFLACIONARIAS — La reexpresión de los estados financieros / Estado de flujos de efectivo — párr. 30 — p. 9,NICSP 10.pdf,"{""chunk_id"": ""NICSP-10-P0030"", ""doc_set"": ""NICSP"", ""norma_id"": ""NICSP-10"", ""norma_titulo"": ""INFORMACIÓN FINANCIERA EN ECONOMÍAS HIPERINFLACIONARIAS"", ""version_corte"": ""2025-01-31"", ""idioma"": ""es"", ""seccion"": ""La reexpresión de los estados financieros"", ""subseccion"": ""Estado de flujos de efectivo"", ""parrafo_ini"": 30, ""parrafo_fin"": 30, ""page_ini_pdf"": 9, ""page_fin_pdf"": 9, ""content_type"": ""paragraph"", ""qa_scope"": ""normativo"", ""source_file"": ""NICSP 10.pdf""}"
NICSP-10-P0031,NICSP,NICSP-10,INFORMACIÓN FINANCIERA EN ECONOMÍAS HIPERINFLACIONARIAS,2025-01-31,es,La reexpresión de los estados financieros,Cifras de periodos anteriores,31,31,10,10,paragraph,"Las cifras correspondientes a las partidas del periodo anterior, ya estén basadas en el método del costo
histórico o del costo corriente, se reexpresarán aplicando un índice general de precios, de forma que los
estados financieros comparativos se presenten en términos de la unidad de medida corriente en la fecha de
cierre del periodo sobre el que se informa. La información que se revele respecto a periodos anteriores se
expresará también en términos de la unidad de medida corriente en la fecha de cierre del periodo sobre el
que se informa. A efectos de presentar los importes comparativos en una moneda de presentación diferente
se aplicarán los párrafos 47(b) y 48 de la NICSP 4.",NICSP-10 — INFORMACIÓN FINANCIERA EN ECONOMÍAS HIPERINFLACIONARIAS — La reexpresión de los estados financieros / Cifras de periodos anteriores — párr. 31 — p. 10,NICSP 10.pdf,"{""chunk_id"": ""NICSP-10-P0031"", ""doc_set"": ""NICSP"", ""norma_id"": ""NICSP-10"", ""norma_titulo"": ""INFORMACIÓN FINANCIERA EN ECONOMÍAS HIPERINFLACIONARIAS"", ""version_corte"": ""2025-01-31"", ""idioma"": ""es"", ""seccion"": ""La reexpresión de los estados financieros"", ""subseccion"": ""Cifras de periodos anteriores"", ""parrafo_ini"": 31, ""parrafo_fin"": 31, ""page_ini_pdf"": 10, ""page_fin_pdf"": 10, ""content_type"": ""paragraph"", ""qa_scope"": ""normativo"", ""source_file"": ""NICSP 10.pdf""}"
NICSP-10-P0032,NICSP,NICSP-10,INFORMACIÓN FINANCIERA EN ECONOMÍAS HIPERINFLACIONARIAS,2025-01-31,es,La reexpresión de los estados financieros,Estados financieros consolidados,32,32,10,10,paragraph,"Una entidad controladora que informa en la moneda de una economía hiperinflacionaria puede tener
entidades controladas que también informan en las monedas de economías hiperinflacionarias. Los estados
financieros de tales entidades controladas necesitarán ser reexpresados, mediante la aplicación de un índice
general de precios correspondiente al país en cuya moneda presentan la información, antes de incluirse en
los estados financieros consolidados a presentar por la controladora. Si tal entidad controlada es una entidad
controlada extranjera, sus estados financieros reexpresados serán convertidos a las tasas de cierre. Los
estados financieros de las entidades controladas que no presenten información en monedas de economías
hiperinflacionarias, se tratarán de acuerdo con lo establecido en la NICSP 4.",NICSP-10 — INFORMACIÓN FINANCIERA EN ECONOMÍAS HIPERINFLACIONARIAS — La reexpresión de los estados financieros / Estados financieros consolidados — párr. 32 — p. 10,NICSP 10.pdf,"{""chunk_id"": ""NICSP-10-P0032"", ""doc_set"": ""NICSP"", ""norma_id"": ""NICSP-10"", ""norma_titulo"": ""INFORMACIÓN FINANCIERA EN ECONOMÍAS HIPERINFLACIONARIAS"", ""version_corte"": ""2025-01-31"", ""idioma"": ""es"", ""seccion"": ""La reexpresión de los estados financieros"", ""subseccion"": ""Estados financieros consolidados"", ""parrafo_ini"": 32, ""parrafo_fin"": 32, ""page_ini_pdf"": 10, ""page_fin_pdf"": 10, ""content_type"": ""paragraph"", ""qa_scope"": ""normativo"", ""source_file"": ""NICSP 10.pdf""}"
NICSP-10-P0033,NICSP,NICSP-10,INFORMACIÓN FINANCIERA EN ECONOMÍAS HIPERINFLACIONARIAS,2025-01-31,es,La reexpresión de los estados financieros,Estados financieros consolidados,33,33,10,10,paragraph,"Si se consolidan estados financieros con fechas de presentación diferentes, todas las partidas, sean o no
monetarias, necesitarán ser reexpresadas en la unidad de medida corriente en la fecha de los estados
financieros consolidados.",NICSP-10 — INFORMACIÓN FINANCIERA EN ECONOMÍAS HIPERINFLACIONARIAS — La reexpresión de los estados financieros / Estados financieros consolidados — párr. 33 — p. 10,NICSP 10.pdf,"{""chunk_id"": ""NICSP-10-P0033"", ""doc_set"": ""NICSP"", ""norma_id"": ""NICSP-10"", ""norma_titulo"": ""INFORMACIÓN FINANCIERA EN ECONOMÍAS HIPERINFLACIONARIAS"", ""version_corte"": ""2025-01-31"", ""idioma"": ""es"", ""seccion"": ""La reexpresión de los estados financieros"", ""subseccion"": ""Estados financieros consolidados"", ""parrafo_ini"": 33, ""parrafo_fin"": 33, ""page_ini_pdf"": 10, ""page_fin_pdf"": 10, ""content_type"": ""paragraph"", ""qa_scope"": ""normativo"", ""source_file"": ""NICSP 10.pdf""}"
NICSP-10-P0034,NICSP,NICSP-10,INFORMACIÓN FINANCIERA EN ECONOMÍAS HIPERINFLACIONARIAS,2025-01-31,es,La reexpresión de los estados financieros,Selección y uso de un índice general de precios,34,34,10,10,paragraph,"La reexpresión de los estados financieros, conforme a lo establecido en esta Norma, exige el uso de un
índice general de precios que refleje los cambios en el poder adquisitivo general. Es preferible que todas las
entidades que presenten información en la moneda de una misma economía utilicen el mismo índice.",NICSP-10 — INFORMACIÓN FINANCIERA EN ECONOMÍAS HIPERINFLACIONARIAS — La reexpresión de los estados financieros / Selección y uso de un índice general de precios — párr. 34 — p. 10,NICSP 10.pdf,"{""chunk_id"": ""NICSP-10-P0034"", ""doc_set"": ""NICSP"", ""norma_id"": ""NICSP-10"", ""norma_titulo"": ""INFORMACIÓN FINANCIERA EN ECONOMÍAS HIPERINFLACIONARIAS"", ""version_corte"": ""2025-01-31"", ""idioma"": ""es"", ""seccion"": ""La reexpresión de los estados financieros"", ""subseccion"": ""Selección y uso de un índice general de precios"", ""parrafo_ini"": 34, ""parrafo_fin"": 34, ""page_ini_pdf"": 10, ""page_fin_pdf"": 10, ""content_type"": ""paragraph"", ""qa_scope"": ""normativo"", ""source_file"": ""NICSP 10.pdf""}"
NICSP-10-P0035,NICSP,NICSP-10,INFORMACIÓN FINANCIERA EN ECONOMÍAS HIPERINFLACIONARIAS,2025-01-31,es,Economías que dejan de ser hiperinflacionarias,,35,35,10,10,paragraph,"Cuando una economía deje de ser hiperinflacionaria y la entidad, por consiguiente, cese en la
preparación y presentación de estados financieros elaborados conforme a lo establecido en esta
Norma, tratará los importes expresados en la unidad de medida corriente al final del periodo previo
como base para los importes en libros en sus estados financieros posteriores.",NICSP-10 — INFORMACIÓN FINANCIERA EN ECONOMÍAS HIPERINFLACIONARIAS — Economías que dejan de ser hiperinflacionarias — párr. 35 — p. 10,NICSP 10.pdf,"{""chunk_id"": ""NICSP-10-P0035"", ""doc_set"": ""NICSP"", ""norma_id"": ""NICSP-10"", ""norma_titulo"": ""INFORMACIÓN FINANCIERA EN ECONOMÍAS HIPERINFLACIONARIAS"", ""version_corte"": ""2025-01-31"", ""idioma"": ""es"", ""seccion"": ""Economías que dejan de ser hiperinflacionarias"", ""subseccion"": null, ""parrafo_ini"": 35, ""parrafo_fin"": 35, ""page_ini_pdf"": 10, ""page_fin_pdf"": 10, ""content_type"": ""paragraph"", ""qa_scope"": ""normativo"", ""source_file"": ""NICSP 10.pdf""}"
NICSP-10-P0036,NICSP,NICSP-10,INFORMACIÓN FINANCIERA EN ECONOMÍAS HIPERINFLACIONARIAS,2025-01-31,es,Información a revelar,,36,36,10,10,paragraph,"Deberá revelarse la siguiente información:
(a) el hecho de que los estados financieros, así como las cifras correspondientes para periodos anteriores,
han sido reexpresadas para considerar los cambios en el poder adquisitivo general de la moneda
funcional y que, como resultado, están expresados en términos de la unidad de medida corriente en
la fecha de presentación de los estados financieros; y
(b) la identificación y nivel del índice de precios en la fecha de presentación, así como el movimiento del
mismo durante el periodo corriente y los anteriores.",NICSP-10 — INFORMACIÓN FINANCIERA EN ECONOMÍAS HIPERINFLACIONARIAS — Información a revelar — párr. 36 — p. 10,NICSP 10.pdf,"{""chunk_id"": ""NICSP-10-P0036"", ""doc_set"": ""NICSP"", ""norma_id"": ""NICSP-10"", ""norma_titulo"": ""INFORMACIÓN FINANCIERA EN ECONOMÍAS HIPERINFLACIONARIAS"", ""version_corte"": ""2025-01-31"", ""idioma"": ""es"", ""seccion"": ""Información a revelar"", ""subseccion"": null, ""parrafo_ini"": 36, ""parrafo_fin"": 36, ""page_ini_pdf"": 10, ""page_fin_pdf"": 10, ""content_type"": ""paragraph"", ""qa_scope"": ""normativo"", ""source_file"": ""NICSP 10.pdf""}"
NICSP-10-P0037,NICSP,NICSP-10,INFORMACIÓN FINANCIERA EN ECONOMÍAS HIPERINFLACIONARIAS,2025-01-31,es,Información a revelar,,37,37,10,10,paragraph,"La información a revelar requerida por esta Norma es necesaria para dejar claras las bases del tratamiento
de los efectos de la hiperinflación en los estados financieros. Además, también tiene la intención de
suministrar la información necesaria para comprender estas bases y los importes resultantes.",NICSP-10 — INFORMACIÓN FINANCIERA EN ECONOMÍAS HIPERINFLACIONARIAS — Información a revelar — párr. 37 — p. 10,NICSP 10.pdf,"{""chunk_id"": ""NICSP-10-P0037"", ""doc_set"": ""NICSP"", ""norma_id"": ""NICSP-10"", ""norma_titulo"": ""INFORMACIÓN FINANCIERA EN ECONOMÍAS HIPERINFLACIONARIAS"", ""version_corte"": ""2025-01-31"", ""idioma"": ""es"", ""seccion"": ""Información a revelar"", ""subseccion"": null, ""parrafo_ini"": 37, ""parrafo_fin"": 37, ""page_ini_pdf"": 10, ""page_fin_pdf"": 10, ""content_type"": ""paragraph"", ""qa_scope"": ""normativo"", ""source_file"": ""NICSP 10.pdf""}"
