chunk_id,doc_set,norma_id,norma_titulo,version_corte,idioma,seccion,subseccion,parrafo_ini,parrafo_fin,page_ini_pdf,page_fin_pdf,content_type,text,citation,source_file,metadata_json
NICSP-10-P0038,NICSP,NICSP-10,INFORMACIÓN FINANCIERA EN ECONOMÍAS HIPERINFLACIONARIAS,2025-01-31,es,Fecha de vigencia,,38,38,11,11,paragraph,"Una entidad aplicará esta Norma para los estados financieros anuales que cubran periodos que
comiencen a partir del 1 de julio de 2002. Se aconseja su aplicación anticipada. Si una entidad aplica
esta Norma en periodos que comiencen antes del 1 de julio de 2002, se revelará este hecho.",NICSP-10 — INFORMACIÓN FINANCIERA EN ECONOMÍAS HIPERINFLACIONARIAS — Fecha de vigencia — párr. 38 — p. 11,NICSP 10.pdf,"{""chunk_id"": ""NICSP-10-P0038"", ""doc_set"": ""NICSP"", ""norma_id"": ""NICSP-10"", ""norma_titulo"": ""INFORMACIÓN FINANCIERA EN ECONOMÍAS HIPERINFLACIONARIAS"", ""version_corte"": ""2025-01-31"", ""idioma"": ""es"", ""seccion"": ""Fecha de vigencia"", ""subseccion"": null, ""parrafo_ini"": 38, ""parrafo_fin"": 38, ""page_ini_pdf"": 11, ""page_fin_pdf"": 11, ""content_type"": ""paragraph"", ""qa_scope"": ""normativo"", ""source_file"": ""NICSP 10.pdf""}"
NICSP-10-P0038A,NICSP,NICSP-10,INFORMACIÓN FINANCIERA EN ECONOMÍAS HIPERINFLACIONARIAS,2025-01-31,es,Fecha de vigencia,,38,38,11,11,paragraph,"Los párrafos 17, 18 y 22 fueron modificados por el documento Mejoras a las NICSP emitido en enero
de 2010. Una entidad deberá aplicar esas modificaciones para los estados financieros anuales que
cubran periodos que comiencen a partir del 1 de enero de 2011. Se aconseja su aplicación anticipada.",NICSP-10 — INFORMACIÓN FINANCIERA EN ECONOMÍAS HIPERINFLACIONARIAS — Fecha de vigencia — párr. 38A — p. 11,NICSP 10.pdf,"{""chunk_id"": ""NICSP-10-P0038A"", ""doc_set"": ""NICSP"", ""norma_id"": ""NICSP-10"", ""norma_titulo"": ""INFORMACIÓN FINANCIERA EN ECONOMÍAS HIPERINFLACIONARIAS"", ""version_corte"": ""2025-01-31"", ""idioma"": ""es"", ""seccion"": ""Fecha de vigencia"", ""subseccion"": null, ""parrafo_ini"": 38, ""parrafo_fin"": 38, ""page_ini_pdf"": 11, ""page_fin_pdf"": 11, ""content_type"": ""paragraph"", ""qa_scope"": ""normativo"", ""source_file"": ""NICSP 10.pdf""}"
NICSP-10-P0038B,NICSP,NICSP-10,INFORMACIÓN FINANCIERA EN ECONOMÍAS HIPERINFLACIONARIAS,2025-01-31,es,Fecha de vigencia,,38,38,11,11,paragraph,"El párrafo 1 existente fue renumerado como 1A y se insertó un párrafo 1 nuevo mediante el
documento Mejoras a las NICSP 2011 emitido en octubre de 2011. Una entidad aplicará esta
modificación para los estados financieros anuales que cubran periodos que comiencen a partir del
1 de enero de 2013. Se aconseja su aplicación anticipada. Si una entidad aplica la modificación para
un periodo que comience antes del 1 de enero de 2013, revelará este hecho.",NICSP-10 — INFORMACIÓN FINANCIERA EN ECONOMÍAS HIPERINFLACIONARIAS — Fecha de vigencia — párr. 38B — p. 11,NICSP 10.pdf,"{""chunk_id"": ""NICSP-10-P0038B"", ""doc_set"": ""NICSP"", ""norma_id"": ""NICSP-10"", ""norma_titulo"": ""INFORMACIÓN FINANCIERA EN ECONOMÍAS HIPERINFLACIONARIAS"", ""version_corte"": ""2025-01-31"", ""idioma"": ""es"", ""seccion"": ""Fecha de vigencia"", ""subseccion"": null, ""parrafo_ini"": 38, ""parrafo_fin"": 38, ""page_ini_pdf"": 11, ""page_fin_pdf"": 11, ""content_type"": ""paragraph"", ""qa_scope"": ""normativo"", ""source_file"": ""NICSP 10.pdf""}"
NICSP-10-P0038C,NICSP,NICSP-10,INFORMACIÓN FINANCIERA EN ECONOMÍAS HIPERINFLACIONARIAS,2025-01-31,es,Fecha de vigencia,,38,38,11,11,paragraph,"El párrafo 39 fue modificado por la NICSP 33, Adopción por primera vez de las Normas
Internacionales de Contabilidad del Sector Público de Base de Acumulación (o devengo) (NICSP)
emitida en enero de 2015. Una entidad debe aplicar esa modificación para los estados financieros
anuales que cubran periodos que comiencen a partir del 1 de enero de 2017. Se permite su aplicación
anticipada. Si una entidad aplicase la NICSP 33 para un periodo que comience antes del 1 de enero
de 2017, la modificación también se aplicará para dicho periodo anterior.",NICSP-10 — INFORMACIÓN FINANCIERA EN ECONOMÍAS HIPERINFLACIONARIAS — Fecha de vigencia — párr. 38C — p. 11,NICSP 10.pdf,"{""chunk_id"": ""NICSP-10-P0038C"", ""doc_set"": ""NICSP"", ""norma_id"": ""NICSP-10"", ""norma_titulo"": ""INFORMACIÓN FINANCIERA EN ECONOMÍAS HIPERINFLACIONARIAS"", ""version_corte"": ""2025-01-31"", ""idioma"": ""es"", ""seccion"": ""Fecha de vigencia"", ""subseccion"": null, ""parrafo_ini"": 38, ""parrafo_fin"": 38, ""page_ini_pdf"": 11, ""page_fin_pdf"": 11, ""content_type"": ""paragraph"", ""qa_scope"": ""normativo"", ""source_file"": ""NICSP 10.pdf""}"
NICSP-10-P0038D,NICSP,NICSP-10,INFORMACIÓN FINANCIERA EN ECONOMÍAS HIPERINFLACIONARIAS,2025-01-31,es,Fecha de vigencia,,38,38,11,11,paragraph,"Los párrafos 2 y 3 fueron eliminados por el documento La Aplicabilidad de las NICSP, emitido en
abril de 2016. Una entidad aplicará esas modificaciones para los estados financieros anuales que
cubran periodos que comiencen a partir del 1 de enero de 2018. Se aconseja su aplicación anticipada.
Si una entidad aplica las modificaciones para un periodo que comience antes del 1 de enero de 2018,
deberá revelar este hecho.",NICSP-10 — INFORMACIÓN FINANCIERA EN ECONOMÍAS HIPERINFLACIONARIAS — Fecha de vigencia — párr. 38D — p. 11,NICSP 10.pdf,"{""chunk_id"": ""NICSP-10-P0038D"", ""doc_set"": ""NICSP"", ""norma_id"": ""NICSP-10"", ""norma_titulo"": ""INFORMACIÓN FINANCIERA EN ECONOMÍAS HIPERINFLACIONARIAS"", ""version_corte"": ""2025-01-31"", ""idioma"": ""es"", ""seccion"": ""Fecha de vigencia"", ""subseccion"": null, ""parrafo_ini"": 38, ""parrafo_fin"": 38, ""page_ini_pdf"": 11, ""page_fin_pdf"": 11, ""content_type"": ""paragraph"", ""qa_scope"": ""normativo"", ""source_file"": ""NICSP 10.pdf""}"
NICSP-10-P0038E,NICSP,NICSP-10,INFORMACIÓN FINANCIERA EN ECONOMÍAS HIPERINFLACIONARIAS,2025-01-31,es,Fecha de vigencia,,38,38,11,11,paragraph,"El párrafo 22 fue modificado por la NICSP 40, Combinaciones del Sector Público, emitida en enero
de 2017. Una entidad deberá aplicar esta modificación para los estados financieros anuales que
cubran periodos que comiencen a partir del 1 de enero de 2019. Se aconseja su aplicación anticipada.
Si una entidad aplicase la modificación para un periodo que comience antes del 1 de enero de 2019,
revelará este hecho y aplicará al mismo tiempo la NICSP 40.",NICSP-10 — INFORMACIÓN FINANCIERA EN ECONOMÍAS HIPERINFLACIONARIAS — Fecha de vigencia — párr. 38E — p. 11,NICSP 10.pdf,"{""chunk_id"": ""NICSP-10-P0038E"", ""doc_set"": ""NICSP"", ""norma_id"": ""NICSP-10"", ""norma_titulo"": ""INFORMACIÓN FINANCIERA EN ECONOMÍAS HIPERINFLACIONARIAS"", ""version_corte"": ""2025-01-31"", ""idioma"": ""es"", ""seccion"": ""Fecha de vigencia"", ""subseccion"": null, ""parrafo_ini"": 38, ""parrafo_fin"": 38, ""page_ini_pdf"": 11, ""page_fin_pdf"": 11, ""content_type"": ""paragraph"", ""qa_scope"": ""normativo"", ""source_file"": ""NICSP 10.pdf""}"
NICSP-10-P0038F,NICSP,NICSP-10,INFORMACIÓN FINANCIERA EN ECONOMÍAS HIPERINFLACIONARIAS,2025-01-31,es,Fecha de vigencia,,38,38,11,11,paragraph,"Los párrafos 1A y 9 fueron modificados por el documento Mejoras a las NICSP 2018, emitido en
octubre de 2018. Una entidad aplicará estas modificaciones para los estados financieros anuales que
cubran periodos que comiencen a partir del 1 de enero de 2019. Se permite su aplicación anticipada.",NICSP-10 — INFORMACIÓN FINANCIERA EN ECONOMÍAS HIPERINFLACIONARIAS — Fecha de vigencia — párr. 38F — p. 11,NICSP 10.pdf,"{""chunk_id"": ""NICSP-10-P0038F"", ""doc_set"": ""NICSP"", ""norma_id"": ""NICSP-10"", ""norma_titulo"": ""INFORMACIÓN FINANCIERA EN ECONOMÍAS HIPERINFLACIONARIAS"", ""version_corte"": ""2025-01-31"", ""idioma"": ""es"", ""seccion"": ""Fecha de vigencia"", ""subseccion"": null, ""parrafo_ini"": 38, ""parrafo_fin"": 38, ""page_ini_pdf"": 11, ""page_fin_pdf"": 11, ""content_type"": ""paragraph"", ""qa_scope"": ""normativo"", ""source_file"": ""NICSP 10.pdf""}"
NICSP-10-P0038G,NICSP,NICSP-10,INFORMACIÓN FINANCIERA EN ECONOMÍAS HIPERINFLACIONARIAS,2025-01-31,es,Fecha de vigencia,,38,38,11,11,paragraph,"El párrafo 31 fue modificado por la NICSP 46, Medición emitida en mayo de 2023. Una entidad aplicará
estas modificaciones para los estados financieros anuales que cubran periodos que comiencen a
partir del 1 de enero de 2025. Se aconseja su aplicación anticipada. Si una entidad aplicase las
modificaciones para un periodo que comience antes del 1 de enero de 2025, revelará este hecho y al
mismo tiempo aplicará la NICSP 46.",NICSP-10 — INFORMACIÓN FINANCIERA EN ECONOMÍAS HIPERINFLACIONARIAS — Fecha de vigencia — párr. 38G — p. 11,NICSP 10.pdf,"{""chunk_id"": ""NICSP-10-P0038G"", ""doc_set"": ""NICSP"", ""norma_id"": ""NICSP-10"", ""norma_titulo"": ""INFORMACIÓN FINANCIERA EN ECONOMÍAS HIPERINFLACIONARIAS"", ""version_corte"": ""2025-01-31"", ""idioma"": ""es"", ""seccion"": ""Fecha de vigencia"", ""subseccion"": null, ""parrafo_ini"": 38, ""parrafo_fin"": 38, ""page_ini_pdf"": 11, ""page_fin_pdf"": 11, ""content_type"": ""paragraph"", ""qa_scope"": ""normativo"", ""source_file"": ""NICSP 10.pdf""}"
NICSP-10-P0038H,NICSP,NICSP-10,INFORMACIÓN FINANCIERA EN ECONOMÍAS HIPERINFLACIONARIAS,2025-01-31,es,Fecha de vigencia,,38,38,11,11,paragraph,"Los párrafos A1 a A4 del Apéndice A fueron añadidos por el documento Modificaciones a las Normas
NICSP: Interpretaciones CINIIF específicas, emitido en enero de 2025. Una entidad aplicará esas
modificaciones a periodos anuales que comiencen a partir del 1 de enero de 2026. Se aconseja su
aplicación anticipada. Si una entidad aplica estas modificaciones a los estados financieros para un
periodo que comience antes del 1 de enero de 2026, revelará este hecho.",NICSP-10 — INFORMACIÓN FINANCIERA EN ECONOMÍAS HIPERINFLACIONARIAS — Fecha de vigencia — párr. 38H — p. 11,NICSP 10.pdf,"{""chunk_id"": ""NICSP-10-P0038H"", ""doc_set"": ""NICSP"", ""norma_id"": ""NICSP-10"", ""norma_titulo"": ""INFORMACIÓN FINANCIERA EN ECONOMÍAS HIPERINFLACIONARIAS"", ""version_corte"": ""2025-01-31"", ""idioma"": ""es"", ""seccion"": ""Fecha de vigencia"", ""subseccion"": null, ""parrafo_ini"": 38, ""parrafo_fin"": 38, ""page_ini_pdf"": 11, ""page_fin_pdf"": 11, ""content_type"": ""paragraph"", ""qa_scope"": ""normativo"", ""source_file"": ""NICSP 10.pdf""}"
NICSP-10-P0039,NICSP,NICSP-10,INFORMACIÓN FINANCIERA EN ECONOMÍAS HIPERINFLACIONARIAS,2025-01-31,es,Fecha de vigencia,,39,39,11,11,paragraph,"Cuando una entidad adopte las NICSP de base contable de acumulación (o devengo), tal como se definen
en la NICSP 33, Adopción por Primera Vez de las Normas Internacionales de Contabilidad del Sector Público
(NICSP), a efectos de información financiera con posterioridad a esta fecha de vigencia, esta Norma se
aplicará a los estados financieros anuales de la entidad que cubran periodos que comiencen a partir de la
fecha de adopción de las NICSP.",NICSP-10 — INFORMACIÓN FINANCIERA EN ECONOMÍAS HIPERINFLACIONARIAS — Fecha de vigencia — párr. 39 — p. 11,NICSP 10.pdf,"{""chunk_id"": ""NICSP-10-P0039"", ""doc_set"": ""NICSP"", ""norma_id"": ""NICSP-10"", ""norma_titulo"": ""INFORMACIÓN FINANCIERA EN ECONOMÍAS HIPERINFLACIONARIAS"", ""version_corte"": ""2025-01-31"", ""idioma"": ""es"", ""seccion"": ""Fecha de vigencia"", ""subseccion"": null, ""parrafo_ini"": 39, ""parrafo_fin"": 39, ""page_ini_pdf"": 11, ""page_fin_pdf"": 11, ""content_type"": ""paragraph"", ""qa_scope"": ""normativo"", ""source_file"": ""NICSP 10.pdf""}"
NICSP-10-PA001,NICSP,NICSP-10,INFORMACIÓN FINANCIERA EN ECONOMÍAS HIPERINFLACIONARIAS,2025-01-31,es,Apéndice A: Aplicación del Procedimiento de Reexpresión según la NICSP 10,,1,1,13,13,paragraph,"Este Apéndice proporciona una guía acerca de la aplicación de los requerimientos de esta Norma en un
período sobre el que se informa en el que una entidad identifique, aplicando los criterios del párrafo 5, la
existencia de hiperinflación en la economía de su moneda funcional, cuando dicha economía no hubiese
sido hiperinflacionaria en un período anterior, y, por lo tanto, reexpresa sus estados financieros de acuerdo
con esta Norma. En concreto, este Apéndice aborda:
(a) ¿cómo se interpreta el requerimiento “...se establecerán en términos de la unidad de medida corriente
al final del periodo sobre el que se informa” que figura en el párrafo 11 cuando la entidad aplique esta
Norma?
(b) ¿cómo una entidad debe contabilizar las partidas iniciales por impuestos diferidos en sus estados
financieros reexpresados?",NICSP-10 — INFORMACIÓN FINANCIERA EN ECONOMÍAS HIPERINFLACIONARIAS — Apéndice A: Aplicación del Procedimiento de Reexpresión según la NICSP 10 — párr. A1 — p. 13,NICSP 10.pdf,"{""chunk_id"": ""NICSP-10-PA001"", ""doc_set"": ""NICSP"", ""norma_id"": ""NICSP-10"", ""norma_titulo"": ""INFORMACIÓN FINANCIERA EN ECONOMÍAS HIPERINFLACIONARIAS"", ""version_corte"": ""2025-01-31"", ""idioma"": ""es"", ""seccion"": ""Apéndice A: Aplicación del Procedimiento de Reexpresión según la NICSP 10"", ""subseccion"": null, ""parrafo_ini"": 1, ""parrafo_fin"": 1, ""page_ini_pdf"": 13, ""page_fin_pdf"": 13, ""content_type"": ""paragraph"", ""qa_scope"": ""normativo"", ""source_file"": ""NICSP 10.pdf""}"
NICSP-10-PA002,NICSP,NICSP-10,INFORMACIÓN FINANCIERA EN ECONOMÍAS HIPERINFLACIONARIAS,2025-01-31,es,Apéndice A: Aplicación del Procedimiento de Reexpresión según la NICSP 10,,2,2,13,13,paragraph,"En el período sobre el que se informa en el que una entidad identifique la existencia de hiperinflación en la
economía de su moneda funcional, sin que haya sido hiperinflacionaria en el período anterior, la entidad
aplicará los requerimientos de esta Norma como si la economía hubiese sido siempre hiperinflacionaria. Por
lo tanto, en relación con las partidas no monetarias medidas al costo histórico, el estado de situación
financiera de apertura de la entidad al principio del período más antiguo presentado en los estados
financieros se reexpresará de forma que refleje el efecto de la inflación desde la fecha en que los activos
fueron adquiridos y los pasivos fueron incurridos o asumidos, hasta la fecha de presentación. Para las
partidas no monetarias registradas en el estado de situación financiera de apertura por sus importes
corrientes en fechas que sean distintas de la de adquisición o asunción, la reexpresión reflejará el efecto de
la inflación desde las fechas en que esos importes en libros fueron determinados hasta la fecha de
presentación.",NICSP-10 — INFORMACIÓN FINANCIERA EN ECONOMÍAS HIPERINFLACIONARIAS — Apéndice A: Aplicación del Procedimiento de Reexpresión según la NICSP 10 — párr. A2 — p. 13,NICSP 10.pdf,"{""chunk_id"": ""NICSP-10-PA002"", ""doc_set"": ""NICSP"", ""norma_id"": ""NICSP-10"", ""norma_titulo"": ""INFORMACIÓN FINANCIERA EN ECONOMÍAS HIPERINFLACIONARIAS"", ""version_corte"": ""2025-01-31"", ""idioma"": ""es"", ""seccion"": ""Apéndice A: Aplicación del Procedimiento de Reexpresión según la NICSP 10"", ""subseccion"": null, ""parrafo_ini"": 2, ""parrafo_fin"": 2, ""page_ini_pdf"": 13, ""page_fin_pdf"": 13, ""content_type"": ""paragraph"", ""qa_scope"": ""normativo"", ""source_file"": ""NICSP 10.pdf""}"
NICSP-10-PA003,NICSP,NICSP-10,INFORMACIÓN FINANCIERA EN ECONOMÍAS HIPERINFLACIONARIAS,2025-01-31,es,Apéndice A: Aplicación del Procedimiento de Reexpresión según la NICSP 10,,3,3,13,13,paragraph,"Después de que una entidad haya reexpresado sus estados financieros, todas las cifras comparativas que
figuren en esos estados para períodos posteriores se reexpresarán aplicando la variación en la unidad de
medida para esos períodos posteriores únicamente a los estados financieros reexpresados en el período
anterior.",NICSP-10 — INFORMACIÓN FINANCIERA EN ECONOMÍAS HIPERINFLACIONARIAS — Apéndice A: Aplicación del Procedimiento de Reexpresión según la NICSP 10 — párr. A3 — p. 13,NICSP 10.pdf,"{""chunk_id"": ""NICSP-10-PA003"", ""doc_set"": ""NICSP"", ""norma_id"": ""NICSP-10"", ""norma_titulo"": ""INFORMACIÓN FINANCIERA EN ECONOMÍAS HIPERINFLACIONARIAS"", ""version_corte"": ""2025-01-31"", ""idioma"": ""es"", ""seccion"": ""Apéndice A: Aplicación del Procedimiento de Reexpresión según la NICSP 10"", ""subseccion"": null, ""parrafo_ini"": 3, ""parrafo_fin"": 3, ""page_ini_pdf"": 13, ""page_fin_pdf"": 13, ""content_type"": ""paragraph"", ""qa_scope"": ""normativo"", ""source_file"": ""NICSP 10.pdf""}"
NICSP-10-PA004,NICSP,NICSP-10,INFORMACIÓN FINANCIERA EN ECONOMÍAS HIPERINFLACIONARIAS,2025-01-31,es,Apéndice A: Aplicación del Procedimiento de Reexpresión según la NICSP 10,,4,4,13,13,paragraph,"Para las entidades que informan sujetas al impuesto a las ganancias, puede encontrarse una guía sobre la
determinación de las partidas de impuestos diferidos en el estado de situación financiera de apertura para
el periodo sobre el que se informa en las normas contables nacionales e internacionales aplicables que
traten de los impuestos a las ganancias.",NICSP-10 — INFORMACIÓN FINANCIERA EN ECONOMÍAS HIPERINFLACIONARIAS — Apéndice A: Aplicación del Procedimiento de Reexpresión según la NICSP 10 — párr. A4 — p. 13,NICSP 10.pdf,"{""chunk_id"": ""NICSP-10-PA004"", ""doc_set"": ""NICSP"", ""norma_id"": ""NICSP-10"", ""norma_titulo"": ""INFORMACIÓN FINANCIERA EN ECONOMÍAS HIPERINFLACIONARIAS"", ""version_corte"": ""2025-01-31"", ""idioma"": ""es"", ""seccion"": ""Apéndice A: Aplicación del Procedimiento de Reexpresión según la NICSP 10"", ""subseccion"": null, ""parrafo_ini"": 4, ""parrafo_fin"": 4, ""page_ini_pdf"": 13, ""page_fin_pdf"": 13, ""content_type"": ""paragraph"", ""qa_scope"": ""normativo"", ""source_file"": ""NICSP 10.pdf""}"
