chunk_id,doc_set,norma_id,norma_titulo,version_corte,idioma,seccion,subseccion,parrafo_ini,parrafo_fin,page_ini_pdf,page_fin_pdf,content_type,text,citation,source_file,metadata_json
NICSP 22-T018,NICSP,NICSP 22,REVELACIÓN DE INFORMACIÓN FINANCIERA SOBRE EL SECTOR GOBIERNO GENERAL,31-01-2025,es,Guía de implementación,Estado de situación financiera del SGG – A 31 de diciembre de 20X2,,,18,20,table,"Guía de implementación
Esta guía acompaña a la NICSP 22, pero no es parte de la misma.
Estructura ilustrativa de los estados financieros
Gobierno A – Extracto de estados financieros
Extracto de las notas a los estados financieros
Nota: Información a revelar del Sector del Gobierno General (SGG)
Las siguientes informaciones a revelar se refieren al Sector Gobierno General (SGG). Reflejan las políticas contables
adoptadas en los estados financieros consolidados excepto cuando los requerimientos de consolidación hayan variado
con respecto al sector corporaciones públicas financieras (CPF) y al sector corporaciones públicas no financieras
(CPNF). De acuerdo con los requerimientos de la NICSP 22, Revelación de Información Financiera sobre el Sector
Gobierno General, las CPF y las CPNF no se consolidan en la información a revelar del SGG, pero se reconocen como
inversiones del mismo. Las inversiones en CPF y CPNF se presentan en una única línea de partida medida al importe
en libros de los activos netos de la entidad participada.
El SGG comprende todos los ministerios del gobierno central y otras entidades controladas por el gobierno que están
principalmente involucradas en actividades no de mercado. Estas entidades son:
Ministerio de x
y
z.
Durante el periodo sobre el que se informa, las actividades relacionadas con el servicio de correos, previamente
asumidas por el ministerio de comunicaciones, se han configurado nuevamente de acuerdo con criterios comerciales
y ya no se incluyen en la información financiera presentada por el SGG.
Estado de situación financiera del SGG – A 31 de diciembre de 20X2
(miles de unidades monetarias)
SGG CPF y CPNF Eliminaciones Total W-de-G
20X2 20X1 20X2 20X1 20X2 20X1 20X2 20X1
ACTIVOS
Activos corrientes
Efectivo y equivalentes al efectivo X X X X (X) (X) X X
Cuentas por cobrar X X X X (X) (X) X X
Inventarios X X X X X X
Pagos anticipados X X X X (X) (X) X X
Inversiones X X X X X X
Otros activos corrientes X X X X X X
X X X X (X) (X) X X
Activos no corrientes
Cuentas por cobrar X X X X (X) (X) X X
Inversiones X X X X X X
Inversiones en otros sectores X X (X) (X)
Otros activos financieros X X X X (X) (X) X X
Infraestructuras, planta y equipo X X X X X X
Terrenos y Edificios X X X X X X
Activos intangibles X X X X X X
Otros activos financieros X X X X X X
X X X X (X) (X) X X
ACTIVO TOTAL X X X X (X) (X) X X
PASIVOS
Pasivos corrientes
Cuentas por pagar X X X X (X) (X) X X
Préstamos corto plazo X X X X X X
Porción de los préstamos con
vencimiento a corto plazo X X X X X X
Provisiones X X X X X X
603 NICSP 22 GUÍA DE IMPLEMENTACIÓN
SGG CPF y CPNF Eliminaciones Total W-de-G
20X2 20X1 20X2 20X1 20X2 20X1 20X2 20X1
Beneficios a los empleados X X X X X X
Otros pasivos corrientes X X X X (X) (X) X X
X X X X (X) (X) X X
Pasivos no corrientes
Cuentas por pagar X X X X (X) (X) X X
Préstamos X X X X X X
Provisiones X X X X X X
Beneficios a los empleados X X X X X X
Otros pasivos X X X X (X) (X) X X
X X X X (X) (X) X X
PASIVO TOTAL X X X X (X) (X) X X
ACTIVOS NETOS X X X X (X) (X) X X
ACTIVOS NETOS/PATRIMONIO
Reservas X X X X (X) (X) X X
Resultado positivo (ahorro)/negativo
(desahorro) acumulado X X X X (X) (X) X X
X X X X (X) (X) X X
ACTIVOS TOTALES
NETOS/PATRIMONIO X X X X (X) (X) X X",NICSP 22 — REVELACIÓN DE INFORMACIÓN FINANCIERA SOBRE EL SECTOR GOBIERNO GENERAL — Guía de implementación / Estado de situación financiera del SGG – A 31 de diciembre de 20X2 — párr. s/n — p. 18-20,NICSP 22.pdf,"{""chunk_id"": ""NICSP 22-T018"", ""doc_set"": ""NICSP"", ""norma_id"": ""NICSP 22"", ""norma_titulo"": ""REVELACIÓN DE INFORMACIÓN FINANCIERA SOBRE EL SECTOR GOBIERNO GENERAL"", ""version_corte"": ""31-01-2025"", ""idioma"": ""es"", ""seccion"": ""Guía de implementación"", ""subseccion"": ""Estado de situación financiera del SGG – A 31 de diciembre de 20X2"", ""parrafo_ini"": null, ""parrafo_fin"": null, ""page_ini_pdf"": 18, ""page_fin_pdf"": 20, ""content_type"": ""table"", ""qa_scope"": ""normativo"", ""source_file"": ""NICSP 22.pdf""}"
NICSP 22-T021,NICSP,NICSP 22,REVELACIÓN DE INFORMACIÓN FINANCIERA SOBRE EL SECTOR GOBIERNO GENERAL,31-01-2025,es,Guía de implementación,Estado del rendimiento financiero del SGG — Del ejercicio cerrado a 31 de diciembre de 20X2 — Clasificación por funciones del gobierno,,,21,21,table,"Estado del rendimiento financiero del SGG—
Del ejercicio cerrado a 31 de diciembre, 20X2—Clasificación por funciones del gobierno
(miles de unidades monetarias)
SGG CPF y CPNF Eliminaciones Total W-de-G
20X2 20X1 20X2 20X1 20X2 20X1 20X2 20X1
Ingresos
Impuestos X X (X) (X) X X
Cuotas, multas, penalizaciones X X X X (X) (X) X X
Ingresos de otros sectores X X X X (X) (X)
Transferencias de otros
gobiernos X X X X X X
Otros ingresos de actividades
ordinarias X X X X (X) (X) X X
Total ingresos X X X X (X) (X) X X
Gastos
Servicios públicos generales X X X X
Defensa X X X X
Orden público y seguridad
nacional X X X X X X
Asuntos económicos X X X X
Protección medioambiental X X X X (X) (X) X X
Vivienda y bienestar social X X X X (X) (X) X X
Sanidad X X X X X X
Ocio, cultura y religión X X X X
Educación X X X X (X) (X) X X
Protección social X X X X (X) (X) X X
Total de gastos X X X X (X) (X) X X
Resultado (ahorro o desahorro)
del periodo X X X X (X) (X) X X
605 NICSP 22 GUÍA DE IMPLEMENTACIÓN",NICSP 22 — REVELACIÓN DE INFORMACIÓN FINANCIERA SOBRE EL SECTOR GOBIERNO GENERAL — Guía de implementación / Estado del rendimiento financiero del SGG — Del ejercicio cerrado a 31 de diciembre de 20X2 — Clasificación por funciones del gobierno — párr. s/n — p. 21,NICSP 22.pdf,"{""chunk_id"": ""NICSP 22-T021"", ""doc_set"": ""NICSP"", ""norma_id"": ""NICSP 22"", ""norma_titulo"": ""REVELACIÓN DE INFORMACIÓN FINANCIERA SOBRE EL SECTOR GOBIERNO GENERAL"", ""version_corte"": ""31-01-2025"", ""idioma"": ""es"", ""seccion"": ""Guía de implementación"", ""subseccion"": ""Estado del rendimiento financiero del SGG — Del ejercicio cerrado a 31 de diciembre de 20X2 — Clasificación por funciones del gobierno"", ""parrafo_ini"": null, ""parrafo_fin"": null, ""page_ini_pdf"": 21, ""page_fin_pdf"": 21, ""content_type"": ""table"", ""qa_scope"": ""normativo"", ""source_file"": ""NICSP 22.pdf""}"
NICSP 22-T022,NICSP,NICSP 22,REVELACIÓN DE INFORMACIÓN FINANCIERA SOBRE EL SECTOR GOBIERNO GENERAL,31-01-2025,es,Guía de implementación,Estado de cambios en los activos netos/patrimonio del SGG – Del ejercicio cerrado a 31 de diciembre de 20X2,,,22,23,table,"Estado de cambios en los activos netos/patrimonio del SGG – Del ejercicio cerrado a 31 de diciembre, 20X2
(miles de unidades monetarias)
SGG
Total
Resultados Gobiern
Acumulados( o en
ahorro o su
Reservas de Reserva de desahorro) CPF y Eliminacione conjunt
revaluación conversión del periodo CPNF s o
Saldo a 31 de diciembre de 20X0 X (X) X X X X
Resultado (ahorro) por
revaluación de propiedades X X X
Resultado (desahorro) por
revaluación de inversiones (X) (X) X (X)
Diferencias de conversión (X) (X) (X)
Pérdidas y ganancias netas no
reconocidas en el estado de
rendimiento financiero X (X) X (X) X
Resultado (ahorro) neto del
ejercicio X X (X) X
Saldo a 31 de diciembre de 20X1 X (X) X X (X) X
Resultado (desahorro) en
revaluación de propiedad (X) (X) X (X)
Resultado (ahorro) por
revaluación de inversiones X X (X) X
Diferencias de conversión (X) X X
Pérdidas y ganancias netas no
reconocidas en el estado de
rendimiento financiero (X) (X) (X) (X) (X)
Resultado (desahorro) neto del
periodo (X) (X) (X) (X)
SGG
Total
Resultados Gobiern
Acumulados( o en
ahorro o su
Reservas de Reserva de desahorro) CPF y Eliminacione conjunt
revaluación conversión del periodo CPNF s o
Saldo a 31 de diciembre de 20X2 X (X) X X (X) X
607 NICSP 22 GUÍA DE IMPLEMENTACIÓN",NICSP 22 — REVELACIÓN DE INFORMACIÓN FINANCIERA SOBRE EL SECTOR GOBIERNO GENERAL — Guía de implementación / Estado de cambios en los activos netos/patrimonio del SGG – Del ejercicio cerrado a 31 de diciembre de 20X2 — párr. s/n — p. 22-23,NICSP 22.pdf,"{""chunk_id"": ""NICSP 22-T022"", ""doc_set"": ""NICSP"", ""norma_id"": ""NICSP 22"", ""norma_titulo"": ""REVELACIÓN DE INFORMACIÓN FINANCIERA SOBRE EL SECTOR GOBIERNO GENERAL"", ""version_corte"": ""31-01-2025"", ""idioma"": ""es"", ""seccion"": ""Guía de implementación"", ""subseccion"": ""Estado de cambios en los activos netos/patrimonio del SGG – Del ejercicio cerrado a 31 de diciembre de 20X2"", ""parrafo_ini"": null, ""parrafo_fin"": null, ""page_ini_pdf"": 22, ""page_fin_pdf"": 23, ""content_type"": ""table"", ""qa_scope"": ""normativo"", ""source_file"": ""NICSP 22.pdf""}"
NICSP 22-T024,NICSP,NICSP 22,REVELACIÓN DE INFORMACIÓN FINANCIERA SOBRE EL SECTOR GOBIERNO GENERAL,31-01-2025,es,Guía de implementación,Estado de flujos de efectivo del SGG – Del ejercicio cerrado a 31 de diciembre de 20X2,,,24,25,table,"Estado de flujos de efectivo del SGG – Del ejercicio cerrado a 31 de diciembre de 20X2
(miles de unidades monetarias)
Total Gobierno
en
SGG CPF y CPNF Eliminaciones su conjunto
20X2 20X1 20X2 20X1 20X2 20X1 20X2 20X1
FLUJOS DE EFECTIVO POR
ACTIVIDADES DE OPERACIÓN
Cobros
Impuestos X X (X) (X) X X
Venta de bienes y servicios X X (X) (X) X X
Subvenciones X X (X) (X) X X
Intereses cobrados X X X X
Dividendos de otros sectores al
gobierno X X (X) (X)
Otros cobros X X X X (X) (X) X X
Pagos
Costos de los empleados (X) (X) (X) (X) (X) (X)
Beneficios por retiro (X) (X) (X) (X) (X) (X)
Proveedores (X) (X) (X) (X) (X) (X)
Intereses pagados (X) (X) (X) (X) (X) (X)
Dividendos a otros sectores (X) (X) X X
Otros pagos (X) (X) (X) (X) X X (X) (X)
Flujos de efectivo netos de las
actividades de operación X X X X (X) (X) X X
FLUJOS DE EFECTIVO DE LAS
ACTIVIDADES DE INVERSIÓN
Compra de planta y equipo (X) (X) (X) (X) (X) (X)
Cobros por venta de planta y equipo X X X X X X
Cobros por venta de inversiones X X X X X X
Compra de valores en moneda
extranjera (X) (X) (X) (X) (X) (X)
Flujos de efectivo netos por
actividades de inversión (X) (X) (X) (X) (X) (X) (X) (X)
Total Gobierno
en
SGG CPF y CPNF Eliminaciones su conjunto
20X2 20X1 20X2 20X1 20X2 20X1 20X2 20X1
FLUJOS DE EFECTIVO DE LAS
ACTIVIDADES DE FINANCIACIÓN
Efectivo recibido por préstamos X X X X X X
Reembolsos de préstamos (X) (X) (X) (X) (X) (X)
Flujos de efectivo netos por
actividades de financiación X X X X (X) (X) X X
Incremento/(Disminución) neta en el
efectivo y equivalentes al efectivo X X X X (X) (X) X X
Efectivo y equivalentes al efectivo al
principio del periodo X X X X (X) (X) X X
Efectivo y equivalentes al efectivo al
final del periodo X X X X (X) (X) X X
609 NICSP 22 GUÍA DE IMPLEMENTACIÓN",NICSP 22 — REVELACIÓN DE INFORMACIÓN FINANCIERA SOBRE EL SECTOR GOBIERNO GENERAL — Guía de implementación / Estado de flujos de efectivo del SGG – Del ejercicio cerrado a 31 de diciembre de 20X2 — párr. s/n — p. 24-25,NICSP 22.pdf,"{""chunk_id"": ""NICSP 22-T024"", ""doc_set"": ""NICSP"", ""norma_id"": ""NICSP 22"", ""norma_titulo"": ""REVELACIÓN DE INFORMACIÓN FINANCIERA SOBRE EL SECTOR GOBIERNO GENERAL"", ""version_corte"": ""31-01-2025"", ""idioma"": ""es"", ""seccion"": ""Guía de implementación"", ""subseccion"": ""Estado de flujos de efectivo del SGG – Del ejercicio cerrado a 31 de diciembre de 20X2"", ""parrafo_ini"": null, ""parrafo_fin"": null, ""page_ini_pdf"": 24, ""page_fin_pdf"": 25, ""content_type"": ""table"", ""qa_scope"": ""normativo"", ""source_file"": ""NICSP 22.pdf""}"
