chunk_id,doc_set,norma_id,norma_titulo,version_corte,idioma,seccion,subseccion,parrafo_ini,parrafo_fin,page_ini_pdf,page_fin_pdf,content_type,text,citation,source_file,metadata_json
NICSP 22-P0017,NICSP,NICSP 22,REVELACIÓN DE INFORMACIÓN FINANCIERA SOBRE EL SECTOR GOBIERNO GENERAL,31-01-2025,es,Definiciones,Sector gobierno general,17,17,8,8,definition,"Según las bases estadísticas de información financiera, el sector público comprende los sectores SGG, CPF
y CPNF. Pueden identificarse subgrupos adicionales dentro de estos sectores para propósitos de análisis
estadísticos.",NICSP 22 — REVELACIÓN DE INFORMACIÓN FINANCIERA SOBRE EL SECTOR GOBIERNO GENERAL — Definiciones / Sector gobierno general — párr. 17 — p. 8,NICSP 22.pdf,"{""chunk_id"": ""NICSP 22-P0017"", ""doc_set"": ""NICSP"", ""norma_id"": ""NICSP 22"", ""norma_titulo"": ""REVELACIÓN DE INFORMACIÓN FINANCIERA SOBRE EL SECTOR GOBIERNO GENERAL"", ""version_corte"": ""31-01-2025"", ""idioma"": ""es"", ""seccion"": ""Definiciones"", ""subseccion"": ""Sector gobierno general"", ""parrafo_ini"": 17, ""parrafo_fin"": 17, ""page_ini_pdf"": 8, ""page_fin_pdf"": 8, ""content_type"": ""definition"", ""qa_scope"": ""normativo"", ""source_file"": ""NICSP 22.pdf""}"
NICSP 22-P0018,NICSP,NICSP 22,REVELACIÓN DE INFORMACIÓN FINANCIERA SOBRE EL SECTOR GOBIERNO GENERAL,31-01-2025,es,Definiciones,Sector gobierno general,18,18,8,8,definition,"El SCN 2008 define el SGG como el que está compuesto de (a) todas las unidades que residen en los
gobiernos centrales, regionales y locales, (b) fondos de seguridad social a cada nivel de gobierno, e (c)
instituciones no lucrativas no de mercado controladas por unidades gubernamentales. Según las bases
estadísticas de información financiera, el SGG comprende las operaciones importantes del gobierno y
habitualmente incluye todas las entidades no lucrativas no de mercado radicadas en el mismo cuyas
operaciones se financian principalmente por el gobierno y las entidades del gobierno. Como tales, la
financiación de estas entidades tiene su origen principalmente en la asignación presupuestaria o la
distribución de los impuestos del gobierno, dividendos de las corporaciones gubernamentales, otros ingresos
y préstamos. El SGG habitualmente incluye entidades tales como los departamentos gubernamentales,
tribunales de justicia, instituciones de educación públicas, centros públicos de sanidad y otras agencias
gubernamentales. El SGG no incluye las CPF y CPNF. La revelación de información del SGG se hará en
aquellas jurisdicciones donde el fortalecimiento de la unión entre las NICSP y las bases estadísticas de
información financiera se considera útil y relevante para los usuarios de los estados financieros. Los
gobiernos que eligen revelar información del SGG necesitarán por tanto asegurar que la información sobre
el SGG incluida en los estados financieros es coherente con la definición de SGG, y cualesquiera
interpretaciones de las anteriores, adoptadas con relación a las bases estadísticas de la información
financiera en su jurisdicción.",NICSP 22 — REVELACIÓN DE INFORMACIÓN FINANCIERA SOBRE EL SECTOR GOBIERNO GENERAL — Definiciones / Sector gobierno general — párr. 18 — p. 8,NICSP 22.pdf,"{""chunk_id"": ""NICSP 22-P0018"", ""doc_set"": ""NICSP"", ""norma_id"": ""NICSP 22"", ""norma_titulo"": ""REVELACIÓN DE INFORMACIÓN FINANCIERA SOBRE EL SECTOR GOBIERNO GENERAL"", ""version_corte"": ""31-01-2025"", ""idioma"": ""es"", ""seccion"": ""Definiciones"", ""subseccion"": ""Sector gobierno general"", ""parrafo_ini"": 18, ""parrafo_fin"": 18, ""page_ini_pdf"": 8, ""page_fin_pdf"": 8, ""content_type"": ""definition"", ""qa_scope"": ""normativo"", ""source_file"": ""NICSP 22.pdf""}"
NICSP 22-P0019,NICSP,NICSP 22,REVELACIÓN DE INFORMACIÓN FINANCIERA SOBRE EL SECTOR GOBIERNO GENERAL,31-01-2025,es,Definiciones,Sector corporaciones públicas financieras,19,19,8,8,definition,"El sector CPF comprende las corporaciones financieras controladas por gobiernos residentes, las cuasi-
corporaciones y las instituciones no lucrativas que realizan principalmente intermediación financiera y
provisión de servicios financieros para el mercado. Se incluyen en este sector los bancos controlados por
los gobiernos, incluyendo los bancos centrales y otras instituciones financieras gubernamentales que operan
con base de mercado.",NICSP 22 — REVELACIÓN DE INFORMACIÓN FINANCIERA SOBRE EL SECTOR GOBIERNO GENERAL — Definiciones / Sector corporaciones públicas financieras — párr. 19 — p. 8,NICSP 22.pdf,"{""chunk_id"": ""NICSP 22-P0019"", ""doc_set"": ""NICSP"", ""norma_id"": ""NICSP 22"", ""norma_titulo"": ""REVELACIÓN DE INFORMACIÓN FINANCIERA SOBRE EL SECTOR GOBIERNO GENERAL"", ""version_corte"": ""31-01-2025"", ""idioma"": ""es"", ""seccion"": ""Definiciones"", ""subseccion"": ""Sector corporaciones públicas financieras"", ""parrafo_ini"": 19, ""parrafo_fin"": 19, ""page_ini_pdf"": 8, ""page_fin_pdf"": 8, ""content_type"": ""definition"", ""qa_scope"": ""normativo"", ""source_file"": ""NICSP 22.pdf""}"
NICSP 22-P0020,NICSP,NICSP 22,REVELACIÓN DE INFORMACIÓN FINANCIERA SOBRE EL SECTOR GOBIERNO GENERAL,31-01-2025,es,Definiciones,Sector corporaciones públicas no financieras,20,20,8,8,definition,"El sector CPNF comprende las corporaciones no financieras controladas por los gobiernos residentes, las
cuasi-corporaciones y las instituciones no lucrativas que producen bienes y servicios no financieros para el
mercado. Se incluyen en este sector las entidades tales como las entidades de servicio público de titularidad
pública y otras entidades que comercian bienes y servicios.",NICSP 22 — REVELACIÓN DE INFORMACIÓN FINANCIERA SOBRE EL SECTOR GOBIERNO GENERAL — Definiciones / Sector corporaciones públicas no financieras — párr. 20 — p. 8,NICSP 22.pdf,"{""chunk_id"": ""NICSP 22-P0020"", ""doc_set"": ""NICSP"", ""norma_id"": ""NICSP 22"", ""norma_titulo"": ""REVELACIÓN DE INFORMACIÓN FINANCIERA SOBRE EL SECTOR GOBIERNO GENERAL"", ""version_corte"": ""31-01-2025"", ""idioma"": ""es"", ""seccion"": ""Definiciones"", ""subseccion"": ""Sector corporaciones públicas no financieras"", ""parrafo_ini"": 20, ""parrafo_fin"": 20, ""page_ini_pdf"": 8, ""page_fin_pdf"": 8, ""content_type"": ""definition"", ""qa_scope"": ""normativo"", ""source_file"": ""NICSP 22.pdf""}"
NICSP 22-P0021,NICSP,NICSP 22,REVELACIÓN DE INFORMACIÓN FINANCIERA SOBRE EL SECTOR GOBIERNO GENERAL,31-01-2025,es,Definiciones,Sector corporaciones públicas no financieras,21,21,8,8,definition,"Las bases estadísticas de información financiera definen:
(a) las corporaciones como entidades legales creadas para producir bienes y servicios para el mercado;
(b) las cuasi-corporaciones como empresas que no se incorporan o se establecen legalmente de otra
manera pero que funcionan como si fueran corporaciones; y
(c) las instituciones no lucrativas como entidades legales u otras que producen o distribuyen bienes y
servicios, pero que no generan ganancias financieras para su entidad controladora.",NICSP 22 — REVELACIÓN DE INFORMACIÓN FINANCIERA SOBRE EL SECTOR GOBIERNO GENERAL — Definiciones / Sector corporaciones públicas no financieras — párr. 21 — p. 8,NICSP 22.pdf,"{""chunk_id"": ""NICSP 22-P0021"", ""doc_set"": ""NICSP"", ""norma_id"": ""NICSP 22"", ""norma_titulo"": ""REVELACIÓN DE INFORMACIÓN FINANCIERA SOBRE EL SECTOR GOBIERNO GENERAL"", ""version_corte"": ""31-01-2025"", ""idioma"": ""es"", ""seccion"": ""Definiciones"", ""subseccion"": ""Sector corporaciones públicas no financieras"", ""parrafo_ini"": 21, ""parrafo_fin"": 21, ""page_ini_pdf"": 8, ""page_fin_pdf"": 8, ""content_type"": ""definition"", ""qa_scope"": ""normativo"", ""source_file"": ""NICSP 22.pdf""}"
NICSP 22-P0022,NICSP,NICSP 22,REVELACIÓN DE INFORMACIÓN FINANCIERA SOBRE EL SECTOR GOBIERNO GENERAL,31-01-2025,es,Definiciones,Sector corporaciones públicas no financieras,22,22,8,9,definition,"Las entidades comerciales del sector público tienen características parecidas a una corporación pública o
cuasi-corporación pública, según se define en las bases estadísticas de información financiera. No obstante,
puede no haber un esquema idéntico para los sectores de las EP y los sectores de las CPF y CPNF. Por
ejemplo, una entidad comercial del sector público no residente no se clasificaría como una CPF o una CPNF.",NICSP 22 — REVELACIÓN DE INFORMACIÓN FINANCIERA SOBRE EL SECTOR GOBIERNO GENERAL — Definiciones / Sector corporaciones públicas no financieras — párr. 22 — p. 8-9,NICSP 22.pdf,"{""chunk_id"": ""NICSP 22-P0022"", ""doc_set"": ""NICSP"", ""norma_id"": ""NICSP 22"", ""norma_titulo"": ""REVELACIÓN DE INFORMACIÓN FINANCIERA SOBRE EL SECTOR GOBIERNO GENERAL"", ""version_corte"": ""31-01-2025"", ""idioma"": ""es"", ""seccion"": ""Definiciones"", ""subseccion"": ""Sector corporaciones públicas no financieras"", ""parrafo_ini"": 22, ""parrafo_fin"": 22, ""page_ini_pdf"": 8, ""page_fin_pdf"": 9, ""content_type"": ""definition"", ""qa_scope"": ""normativo"", ""source_file"": ""NICSP 22.pdf""}"
NICSP 22-P0023,NICSP,NICSP 22,REVELACIÓN DE INFORMACIÓN FINANCIERA SOBRE EL SECTOR GOBIERNO GENERAL,31-01-2025,es,Políticas contables,,23,23,9,9,paragraph,"La información financiera sobre el SGG deberá revelarse de acuerdo con las políticas contables
adoptadas para preparar y presentar los estados financieros consolidados del gobierno, a excepción
de lo requerido en los párrafos 24 y 25.",NICSP 22 — REVELACIÓN DE INFORMACIÓN FINANCIERA SOBRE EL SECTOR GOBIERNO GENERAL — Políticas contables — párr. 23 — p. 9,NICSP 22.pdf,"{""chunk_id"": ""NICSP 22-P0023"", ""doc_set"": ""NICSP"", ""norma_id"": ""NICSP 22"", ""norma_titulo"": ""REVELACIÓN DE INFORMACIÓN FINANCIERA SOBRE EL SECTOR GOBIERNO GENERAL"", ""version_corte"": ""31-01-2025"", ""idioma"": ""es"", ""seccion"": ""Políticas contables"", ""subseccion"": null, ""parrafo_ini"": 23, ""parrafo_fin"": 23, ""page_ini_pdf"": 9, ""page_fin_pdf"": 9, ""content_type"": ""paragraph"", ""qa_scope"": ""normativo"", ""source_file"": ""NICSP 22.pdf""}"
NICSP 22-P0024,NICSP,NICSP 22,REVELACIÓN DE INFORMACIÓN FINANCIERA SOBRE EL SECTOR GOBIERNO GENERAL,31-01-2025,es,Políticas contables,,24,24,9,9,paragraph,"Al presentar información financiera sobre el SGG, las entidades no aplicarán la NICSP 35, Estados
Financieros Consolidados, en relación con las entidades de los sectores CPF y CPNF públicos.",NICSP 22 — REVELACIÓN DE INFORMACIÓN FINANCIERA SOBRE EL SECTOR GOBIERNO GENERAL — Políticas contables — párr. 24 — p. 9,NICSP 22.pdf,"{""chunk_id"": ""NICSP 22-P0024"", ""doc_set"": ""NICSP"", ""norma_id"": ""NICSP 22"", ""norma_titulo"": ""REVELACIÓN DE INFORMACIÓN FINANCIERA SOBRE EL SECTOR GOBIERNO GENERAL"", ""version_corte"": ""31-01-2025"", ""idioma"": ""es"", ""seccion"": ""Políticas contables"", ""subseccion"": null, ""parrafo_ini"": 24, ""parrafo_fin"": 24, ""page_ini_pdf"": 9, ""page_fin_pdf"": 9, ""content_type"": ""paragraph"", ""qa_scope"": ""normativo"", ""source_file"": ""NICSP 22.pdf""}"
NICSP 22-P0025,NICSP,NICSP 22,REVELACIÓN DE INFORMACIÓN FINANCIERA SOBRE EL SECTOR GOBIERNO GENERAL,31-01-2025,es,Políticas contables,,25,25,9,9,paragraph,"El SGG reconocerá su inversión en los sectores CPF y CPNF públicos como un activo, y contabilizará
para este activo el importe en libros de los activos netos de sus entidades participadas.",NICSP 22 — REVELACIÓN DE INFORMACIÓN FINANCIERA SOBRE EL SECTOR GOBIERNO GENERAL — Políticas contables — párr. 25 — p. 9,NICSP 22.pdf,"{""chunk_id"": ""NICSP 22-P0025"", ""doc_set"": ""NICSP"", ""norma_id"": ""NICSP 22"", ""norma_titulo"": ""REVELACIÓN DE INFORMACIÓN FINANCIERA SOBRE EL SECTOR GOBIERNO GENERAL"", ""version_corte"": ""31-01-2025"", ""idioma"": ""es"", ""seccion"": ""Políticas contables"", ""subseccion"": null, ""parrafo_ini"": 25, ""parrafo_fin"": 25, ""page_ini_pdf"": 9, ""page_fin_pdf"": 9, ""content_type"": ""paragraph"", ""qa_scope"": ""normativo"", ""source_file"": ""NICSP 22.pdf""}"
NICSP 22-P0026,NICSP,NICSP 22,REVELACIÓN DE INFORMACIÓN FINANCIERA SOBRE EL SECTOR GOBIERNO GENERAL,31-01-2025,es,Políticas contables,,26,26,9,9,paragraph,"Esta Norma refleja la opinión de que los estados financieros consolidados de un gobierno que elige revelar
información sobre el SGG tienen que desagregarse para presentar el SGG como un sector del gobierno
como entidad que informa. En congruencia con esta opinión, esta Norma requiere que se apliquen las
mismas definiciones y requerimientos de reconocimiento, medición y presentación al preparar los estados
financieros consolidados que se aplican también en la revelación de información del SGG, con una
excepción. Esta excepción es que no se apliquen los requerimientos de la NICSP 35 respecto a la relación
del SGG con las entidades de los sectores CPF y CPNF.",NICSP 22 — REVELACIÓN DE INFORMACIÓN FINANCIERA SOBRE EL SECTOR GOBIERNO GENERAL — Políticas contables — párr. 26 — p. 9,NICSP 22.pdf,"{""chunk_id"": ""NICSP 22-P0026"", ""doc_set"": ""NICSP"", ""norma_id"": ""NICSP 22"", ""norma_titulo"": ""REVELACIÓN DE INFORMACIÓN FINANCIERA SOBRE EL SECTOR GOBIERNO GENERAL"", ""version_corte"": ""31-01-2025"", ""idioma"": ""es"", ""seccion"": ""Políticas contables"", ""subseccion"": null, ""parrafo_ini"": 26, ""parrafo_fin"": 26, ""page_ini_pdf"": 9, ""page_fin_pdf"": 9, ""content_type"": ""paragraph"", ""qa_scope"": ""normativo"", ""source_file"": ""NICSP 22.pdf""}"
NICSP 22-P0027,NICSP,NICSP 22,REVELACIÓN DE INFORMACIÓN FINANCIERA SOBRE EL SECTOR GOBIERNO GENERAL,31-01-2025,es,Políticas contables,,27,27,9,9,paragraph,"La NICSP 35 requiere que las entidades controladoras preparen los estados financieros que consolidan las
entidades controladas partida por partida. La NICSP 35 también contiene (a) una discusión detallada del
concepto de control que se aplica en el sector público, y (b) una guía para determinar si existe control para
propósitos de información financiera. En coherencia con los requerimientos de la NICSP 35, las entidades
de los sectores CPF y CPNF, como se define en las bases estadísticas de información financiera, que son
entidades controladas del gobierno se consolidarán en los estados financieros del gobierno.",NICSP 22 — REVELACIÓN DE INFORMACIÓN FINANCIERA SOBRE EL SECTOR GOBIERNO GENERAL — Políticas contables — párr. 27 — p. 9,NICSP 22.pdf,"{""chunk_id"": ""NICSP 22-P0027"", ""doc_set"": ""NICSP"", ""norma_id"": ""NICSP 22"", ""norma_titulo"": ""REVELACIÓN DE INFORMACIÓN FINANCIERA SOBRE EL SECTOR GOBIERNO GENERAL"", ""version_corte"": ""31-01-2025"", ""idioma"": ""es"", ""seccion"": ""Políticas contables"", ""subseccion"": null, ""parrafo_ini"": 27, ""parrafo_fin"": 27, ""page_ini_pdf"": 9, ""page_fin_pdf"": 9, ""content_type"": ""paragraph"", ""qa_scope"": ""normativo"", ""source_file"": ""NICSP 22.pdf""}"
NICSP 22-P0028,NICSP,NICSP 22,REVELACIÓN DE INFORMACIÓN FINANCIERA SOBRE EL SECTOR GOBIERNO GENERAL,31-01-2025,es,Políticas contables,,28,28,9,9,paragraph,"Los estados financieros preparados en congruencia con las bases estadísticas de información financiera
reflejan el impacto del SGG en el sector público en su conjunto y, en el contexto del SCN 2008, en la
economía nacional. En coherencia con este enfoque, las bases estadísticas de información financiera
requieren que los estados financieros del SGG presenten las entidades del sector público fuera de este
sector como inversiones en otros sectores. Además, según las bases estadísticas de información financiera,
las transacciones del SGG con entidades en otros sectores no se eliminan del estado de las operaciones
gubernamentales o un estado similar.",NICSP 22 — REVELACIÓN DE INFORMACIÓN FINANCIERA SOBRE EL SECTOR GOBIERNO GENERAL — Políticas contables — párr. 28 — p. 9,NICSP 22.pdf,"{""chunk_id"": ""NICSP 22-P0028"", ""doc_set"": ""NICSP"", ""norma_id"": ""NICSP 22"", ""norma_titulo"": ""REVELACIÓN DE INFORMACIÓN FINANCIERA SOBRE EL SECTOR GOBIERNO GENERAL"", ""version_corte"": ""31-01-2025"", ""idioma"": ""es"", ""seccion"": ""Políticas contables"", ""subseccion"": null, ""parrafo_ini"": 28, ""parrafo_fin"": 28, ""page_ini_pdf"": 9, ""page_fin_pdf"": 9, ""content_type"": ""paragraph"", ""qa_scope"": ""normativo"", ""source_file"": ""NICSP 22.pdf""}"
NICSP 22-P0029,NICSP,NICSP 22,REVELACIÓN DE INFORMACIÓN FINANCIERA SOBRE EL SECTOR GOBIERNO GENERAL,31-01-2025,es,Políticas contables,,29,29,9,9,paragraph,"Aplicar los requerimientos de la NICSP 35 para la consolidación del SGG daría lugar a la nueva presentación
de los estados financieros consolidados de un gobierno, en lugar de los estados financieros del SGG.",NICSP 22 — REVELACIÓN DE INFORMACIÓN FINANCIERA SOBRE EL SECTOR GOBIERNO GENERAL — Políticas contables — párr. 29 — p. 9,NICSP 22.pdf,"{""chunk_id"": ""NICSP 22-P0029"", ""doc_set"": ""NICSP"", ""norma_id"": ""NICSP 22"", ""norma_titulo"": ""REVELACIÓN DE INFORMACIÓN FINANCIERA SOBRE EL SECTOR GOBIERNO GENERAL"", ""version_corte"": ""31-01-2025"", ""idioma"": ""es"", ""seccion"": ""Políticas contables"", ""subseccion"": null, ""parrafo_ini"": 29, ""parrafo_fin"": 29, ""page_ini_pdf"": 9, ""page_fin_pdf"": 9, ""content_type"": ""paragraph"", ""qa_scope"": ""normativo"", ""source_file"": ""NICSP 22.pdf""}"
NICSP 22-P0030,NICSP,NICSP 22,REVELACIÓN DE INFORMACIÓN FINANCIERA SOBRE EL SECTOR GOBIERNO GENERAL,31-01-2025,es,Políticas contables,,30,30,9,9,paragraph,"Por tanto, al revelar información financiera sobre el SGG, se eliminan los saldos y las transacciones entre
entidades dentro del SGG de acuerdo con la NICSP 35. No obstante, los saldos y transacciones entre
entidades del SGG y entidades de otros sectores no se eliminan.",NICSP 22 — REVELACIÓN DE INFORMACIÓN FINANCIERA SOBRE EL SECTOR GOBIERNO GENERAL — Políticas contables — párr. 30 — p. 9,NICSP 22.pdf,"{""chunk_id"": ""NICSP 22-P0030"", ""doc_set"": ""NICSP"", ""norma_id"": ""NICSP 22"", ""norma_titulo"": ""REVELACIÓN DE INFORMACIÓN FINANCIERA SOBRE EL SECTOR GOBIERNO GENERAL"", ""version_corte"": ""31-01-2025"", ""idioma"": ""es"", ""seccion"": ""Políticas contables"", ""subseccion"": null, ""parrafo_ini"": 30, ""parrafo_fin"": 30, ""page_ini_pdf"": 9, ""page_fin_pdf"": 9, ""content_type"": ""paragraph"", ""qa_scope"": ""normativo"", ""source_file"": ""NICSP 22.pdf""}"
NICSP 22-P0031,NICSP,NICSP 22,REVELACIÓN DE INFORMACIÓN FINANCIERA SOBRE EL SECTOR GOBIERNO GENERAL,31-01-2025,es,Políticas contables,,31,31,9,9,paragraph,"Esta Norma requiere que el sector SGG reconozca su inversión en entidades en los sectores CPF y CPNF
por el importe en libros de los activos netos de estas entidades. Esto asegurará que la revelación de
información del SGG refleje una desagregación de la información financiera presentada en los estados
financieros consolidados del gobierno del cual forma parte. En coherencia con que el SGG sea una
desagregación de los estados financieros consolidados de un gobierno, los cambios en el importe en libros
de los activos netos de estas entidades se reconocerán de la misma manera que se reconocieron en los
estados financieros consolidados de un gobierno.",NICSP 22 — REVELACIÓN DE INFORMACIÓN FINANCIERA SOBRE EL SECTOR GOBIERNO GENERAL — Políticas contables — párr. 31 — p. 9,NICSP 22.pdf,"{""chunk_id"": ""NICSP 22-P0031"", ""doc_set"": ""NICSP"", ""norma_id"": ""NICSP 22"", ""norma_titulo"": ""REVELACIÓN DE INFORMACIÓN FINANCIERA SOBRE EL SECTOR GOBIERNO GENERAL"", ""version_corte"": ""31-01-2025"", ""idioma"": ""es"", ""seccion"": ""Políticas contables"", ""subseccion"": null, ""parrafo_ini"": 31, ""parrafo_fin"": 31, ""page_ini_pdf"": 9, ""page_fin_pdf"": 9, ""content_type"": ""paragraph"", ""qa_scope"": ""normativo"", ""source_file"": ""NICSP 22.pdf""}"
NICSP 22-P0032,NICSP,NICSP 22,REVELACIÓN DE INFORMACIÓN FINANCIERA SOBRE EL SECTOR GOBIERNO GENERAL,31-01-2025,es,Políticas contables,,32,32,10,10,paragraph,"Las bases estadísticas de información financiera requieren que todos los activos y pasivos (excepto los
préstamos) se revalúen a valor de mercado en cada fecha de presentación. Las NICSP incluyen diferentes
requerimientos de medición, y requieren o permiten un modelo del costo histórico y un modelo de valores
actuales para ciertas clases de activos y pasivos; No requieren que se revalúen todos los activos y pasivos
a valor de mercado. Por tanto, la medición de activos y pasivos en la información revelada del SGG en los
estados financieros, incluyendo la inversión en los sectores de CPF y CPNF, puede diferir de las bases de
medición adoptadas por las bases estadísticas de información.",NICSP 22 — REVELACIÓN DE INFORMACIÓN FINANCIERA SOBRE EL SECTOR GOBIERNO GENERAL — Políticas contables — párr. 32 — p. 10,NICSP 22.pdf,"{""chunk_id"": ""NICSP 22-P0032"", ""doc_set"": ""NICSP"", ""norma_id"": ""NICSP 22"", ""norma_titulo"": ""REVELACIÓN DE INFORMACIÓN FINANCIERA SOBRE EL SECTOR GOBIERNO GENERAL"", ""version_corte"": ""31-01-2025"", ""idioma"": ""es"", ""seccion"": ""Políticas contables"", ""subseccion"": null, ""parrafo_ini"": 32, ""parrafo_fin"": 32, ""page_ini_pdf"": 10, ""page_fin_pdf"": 10, ""content_type"": ""paragraph"", ""qa_scope"": ""normativo"", ""source_file"": ""NICSP 22.pdf""}"
NICSP 22-P0033,NICSP,NICSP 22,REVELACIÓN DE INFORMACIÓN FINANCIERA SOBRE EL SECTOR GOBIERNO GENERAL,31-01-2025,es,Políticas contables,Desagregación adicional,33,33,10,10,paragraph,"En algunas jurisdicciones, los gobiernos nacionales pueden controlar gobiernos provinciales y/o locales, y,
en consecuencia, los estados financieros del gobierno nacional consolidarán diferentes niveles de gobierno.
Si los estados financieros consolidan diferentes niveles de gobierno, puede darse una desagregación
adicional de los estados financieros consolidados de acuerdo con los requerimientos de esta Norma de
revelar información de manera separada sobre el SGG a cada nivel de gobierno.",NICSP 22 — REVELACIÓN DE INFORMACIÓN FINANCIERA SOBRE EL SECTOR GOBIERNO GENERAL — Políticas contables / Desagregación adicional — párr. 33 — p. 10,NICSP 22.pdf,"{""chunk_id"": ""NICSP 22-P0033"", ""doc_set"": ""NICSP"", ""norma_id"": ""NICSP 22"", ""norma_titulo"": ""REVELACIÓN DE INFORMACIÓN FINANCIERA SOBRE EL SECTOR GOBIERNO GENERAL"", ""version_corte"": ""31-01-2025"", ""idioma"": ""es"", ""seccion"": ""Políticas contables"", ""subseccion"": ""Desagregación adicional"", ""parrafo_ini"": 33, ""parrafo_fin"": 33, ""page_ini_pdf"": 10, ""page_fin_pdf"": 10, ""content_type"": ""paragraph"", ""qa_scope"": ""normativo"", ""source_file"": ""NICSP 22.pdf""}"
NICSP 22-P0034,NICSP,NICSP 22,REVELACIÓN DE INFORMACIÓN FINANCIERA SOBRE EL SECTOR GOBIERNO GENERAL,31-01-2025,es,Políticas contables,Desagregación adicional,34,34,10,10,paragraph,"Esta desagregación adicional no es requerida por esta Norma. Sin embargo, puede presentarse para ayudar
más a los usuarios a entender mejor la relación entre las actividades del SGG de cada nivel de gobierno
consolidado en los estados financieros, y la relación entre los estados financieros y las bases estadísticas
de información financiera en estas jurisdicciones.",NICSP 22 — REVELACIÓN DE INFORMACIÓN FINANCIERA SOBRE EL SECTOR GOBIERNO GENERAL — Políticas contables / Desagregación adicional — párr. 34 — p. 10,NICSP 22.pdf,"{""chunk_id"": ""NICSP 22-P0034"", ""doc_set"": ""NICSP"", ""norma_id"": ""NICSP 22"", ""norma_titulo"": ""REVELACIÓN DE INFORMACIÓN FINANCIERA SOBRE EL SECTOR GOBIERNO GENERAL"", ""version_corte"": ""31-01-2025"", ""idioma"": ""es"", ""seccion"": ""Políticas contables"", ""subseccion"": ""Desagregación adicional"", ""parrafo_ini"": 34, ""parrafo_fin"": 34, ""page_ini_pdf"": 10, ""page_fin_pdf"": 10, ""content_type"": ""paragraph"", ""qa_scope"": ""normativo"", ""source_file"": ""NICSP 22.pdf""}"
NICSP 22-P0035,NICSP,NICSP 22,REVELACIÓN DE INFORMACIÓN FINANCIERA SOBRE EL SECTOR GOBIERNO GENERAL,31-01-2025,es,Información a revelar,,35,35,10,10,paragraph,"La información a revelar respecto al SGG incluirá al menos lo siguiente:
(a) activos en función de sus principales clases, mostrando de manera separada la inversión en
otros sectores;
(b) pasivos en función de sus principales clases;
(c) activos netos/patrimonio;
(d) incrementos y disminuciones totales de revaluación y otras partidas de ingresos y gastos
reconocidos directamente en los activos netos/patrimonio;
(e) ingresos en función de sus principales clases;
(f) gastos en función de sus principales clases;
(g) resultado (ahorro o desahorro);
(h) flujos de efectivo de las actividades de operación en función de sus principales clases;
(i) flujos de efectivo por actividades de inversión; y
(j) flujos de efectivo por actividades de financiación.
La manera de revelar la información del SGG no será más destacada que la de los estados financieros
consolidados preparados según las NICSP.",NICSP 22 — REVELACIÓN DE INFORMACIÓN FINANCIERA SOBRE EL SECTOR GOBIERNO GENERAL — Información a revelar — párr. 35 — p. 10,NICSP 22.pdf,"{""chunk_id"": ""NICSP 22-P0035"", ""doc_set"": ""NICSP"", ""norma_id"": ""NICSP 22"", ""norma_titulo"": ""REVELACIÓN DE INFORMACIÓN FINANCIERA SOBRE EL SECTOR GOBIERNO GENERAL"", ""version_corte"": ""31-01-2025"", ""idioma"": ""es"", ""seccion"": ""Información a revelar"", ""subseccion"": null, ""parrafo_ini"": 35, ""parrafo_fin"": 35, ""page_ini_pdf"": 10, ""page_fin_pdf"": 10, ""content_type"": ""paragraph"", ""qa_scope"": ""normativo"", ""source_file"": ""NICSP 22.pdf""}"
